url,silo,page_type,template,funnel_stage,schema_type,has_faq,faq_count,trust_strip,reviewed_by_david,title,title_len,meta_desc_len,h1,in_sitemap
/find-an-accountant/new-york/cities/albany/,find-an-accountant,location-child,t-location,BOFU,Service,yes,8,none,yes,Albany Bookkeeper &amp; QuickBooks Accountant · TechBrot,56,149,Albany bookkeeper &amp; QuickBooks accountant.,yes
/find-an-accountant/new-york/cities/bronx/,find-an-accountant,location-child,t-location,BOFU,Service,yes,8,none,yes,The Bronx Bookkeeper &amp; QuickBooks Accountant · TechBrot,59,162,The Bronx bookkeeper &amp; QuickBooks accountant.,yes
/find-an-accountant/new-york/cities/brooklyn/,find-an-accountant,location-child,t-location,BOFU,Service,yes,8,none,yes,Brooklyn Bookkeeper &amp; QuickBooks Accountant · TechBrot,58,163,Brooklyn bookkeeper &amp; QuickBooks accountant.,yes
/find-an-accountant/new-york/cities/buffalo/,find-an-accountant,location-child,t-location,BOFU,Service,yes,8,none,yes,Buffalo Bookkeeper &amp; QuickBooks Accountant · TechBrot,57,157,Buffalo bookkeeper &amp; QuickBooks accountant.,yes
/find-an-accountant/new-york/cities/manhattan/,find-an-accountant,location-child,t-location,BOFU,Service,yes,8,none,yes,"Manhattan Bookkeeper · Sales Tax, UBT &amp; CRT · TechBrot",58,152,Manhattan bookkeeping &mdash; the only borough with three NYC taxes to track.,yes
/find-an-accountant/new-york/cities/new-york-city/,find-an-accountant,location-child,t-location,BOFU,Service,yes,8,none,yes,New York City Bookkeeper &amp; QuickBooks Accountant · TechBrot,63,154,New York City bookkeeper &amp; QuickBooks accountant.,yes
/find-an-accountant/new-york/cities/queens/,find-an-accountant,location-child,t-location,BOFU,Service,yes,8,none,yes,Queens Bookkeeper &amp; QuickBooks Accountant · TechBrot,56,156,Queens bookkeeper &amp; QuickBooks accountant.,yes
/find-an-accountant/new-york/cities/rochester/,find-an-accountant,location-child,t-location,BOFU,Service,yes,8,none,yes,Rochester Bookkeeper &amp; QuickBooks Accountant · TechBrot,59,158,Rochester bookkeeper &amp; QuickBooks accountant.,yes
/find-an-accountant/new-york/cities/staten-island/,find-an-accountant,location-child,t-location,BOFU,Service,yes,8,none,yes,Staten Island Bookkeeper &amp; QuickBooks Accountant · TechBrot,63,159,Staten Island bookkeeper &amp; QuickBooks accountant.,yes
/find-an-accountant/new-york/cities/syracuse/,find-an-accountant,location-child,t-location,BOFU,Service,yes,8,none,yes,Syracuse Bookkeeper &amp; QuickBooks Accountant · TechBrot,58,156,Syracuse bookkeeper &amp; QuickBooks accountant.,yes
/find-an-accountant/new-york/cities/yonkers/,find-an-accountant,location-child,t-location,BOFU,Service,yes,8,none,yes,Yonkers Bookkeeper &amp; QuickBooks Accountant · TechBrot,57,159,Yonkers bookkeeper &amp; QuickBooks accountant.,yes
/find-an-accountant/new-york/cleanup-bookkeeping/,find-an-accountant,location-child,t-money,BOFU,Service,yes,8,badge,yes,New York Bookkeeping Cleanup · Fix Messy Books · TechBrot,57,146,"New York bookkeeping cleanup &mdash; messy books are common, and fixable.",yes
/find-an-accountant/new-york/industries/,find-an-accountant,location-child,t-location,BOFU,FAQPage,yes,6,none,yes,New York Industry Accounting &amp; Bookkeeping · TechBrot,57,159,New York industry accounting &mdash; built around how your business runs.,yes
/find-an-accountant/new-york/industries/construction/,find-an-accountant,location-child,t-location,BOFU,Service,yes,7,none,yes,New York Construction Accounting &amp; Job Costing · TechBrot,61,155,New York construction accounting that knows which job made money.,yes
/find-an-accountant/new-york/industries/consulting/,find-an-accountant,location-child,t-location,BOFU,Service,yes,8,none,yes,New York Consulting Accounting · TechBrot,41,157,New York consulting accounting that shows which clients actually pay.,yes
/find-an-accountant/new-york/industries/ecommerce/,find-an-accountant,location-child,t-location,BOFU,Service,yes,8,none,yes,New York E-commerce Accounting · TechBrot,41,159,New York e-commerce accounting that survives a sales-tax audit.,yes
/find-an-accountant/new-york/industries/healthcare/,find-an-accountant,location-child,t-location,BOFU,Service,yes,8,none,yes,New York Medical Practice Accounting · TechBrot,47,156,"New York medical practice accounting that handles payers, not just expenses.",yes
/find-an-accountant/new-york/industries/legal/,find-an-accountant,location-child,t-location,BOFU,Service,yes,8,none,yes,New York Law Firm Accounting · TechBrot,39,151,New York law firm accounting built around the IOLA trust rules.,yes
/find-an-accountant/new-york/industries/nonprofit/,find-an-accountant,location-child,t-location,BOFU,Service,yes,8,none,yes,New York Nonprofit Accounting · TechBrot,40,155,New York nonprofit accounting built for the CHAR500 and your board.,yes
/find-an-accountant/new-york/industries/real-estate/,find-an-accountant,location-child,t-location,BOFU,Service,yes,8,none,yes,New York Real Estate Accounting · TechBrot,42,154,New York real estate accounting that tracks every property on its own.,yes
/find-an-accountant/new-york/industries/restaurant/,find-an-accountant,location-child,t-location,BOFU,Service,yes,8,none,yes,New York Restaurant Accounting · TechBrot,41,153,New York restaurant accounting that gets tip wages and sales tax right.,yes
/find-an-accountant/new-york/monthly-bookkeeping/,find-an-accountant,location-child,t-money,BOFU,Service,yes,8,badge,yes,New York Monthly Bookkeeping · Close by the 15th · TechBrot,59,154,"New York monthly bookkeeping &mdash; books closed every month, on time.",yes
/find-an-accountant/new-york/pricing/,find-an-accountant,location-child,t-prose,BOFU,Service,yes,7,badge,yes,New York Bookkeeping &amp; QuickBooks Pricing · TechBrot,56,157,Fixed-fee New York pricing &mdash; written scope before any work.,yes
/find-an-accountant/new-york/quickbooks-accountant/,find-an-accountant,location-child,t-money,BOFU,Service,yes,8,badge,yes,New York QuickBooks Accountant &amp; ProAdvisor · TechBrot,58,139,"Your New York QuickBooks accountant &mdash; ProAdvisor expertise, New York rules.",yes
/find-an-accountant/new-york/quickbooks-cleanup/,find-an-accountant,location-child,t-money,BOFU,Service,yes,7,badge,yes,New York QuickBooks Cleanup &amp; File Repair · TechBrot,56,149,When QuickBooks itself is the problem .,yes
/find-an-accountant/new-york/quickbooks-migration/,find-an-accountant,location-child,t-money,BOFU,Service,yes,7,badge,yes,New York QuickBooks Migration · Desktop to Online · TechBrot,60,149,QuickBooks Desktop is ending. Migrate professionally.,yes
/find-an-accountant/new-york/quickbooks-reconciliation/,find-an-accountant,location-child,t-money,BOFU,Service,yes,8,none,yes,New York QuickBooks Reconciliation · TechBrot,45,148,New York QuickBooks reconciliation that ties every account to reality.,yes
/find-an-accountant/new-york/quickbooks-setup/,find-an-accountant,location-child,t-money,BOFU,Service,yes,8,none,yes,New York QuickBooks Setup · TechBrot,36,142,New York QuickBooks setup done right from day one.,yes
/find-an-accountant/new-york/quickbooks-training/,find-an-accountant,location-child,t-money,BOFU,Service,yes,7,none,yes,New York QuickBooks Training · TechBrot,39,146,Learn QuickBooks the way your business actually uses it.,yes
/find-an-accountant/new-york/sales-tax-help/,find-an-accountant,location-child,t-money,BOFU,Service,yes,8,none,yes,New York Sales Tax Help for Businesses · TechBrot,49,152,"New York sales tax , tracked right in your books.",yes
/find-an-accountant/new-york/small-business-accountant/,find-an-accountant,location-child,t-money,BOFU,Service,yes,8,none,yes,New York Small Business Accountant · TechBrot,45,157,"Your New York small business accountant, starting with the books.",yes
/find-an-accountant/new-york/speak-to-a-proadvisor/,find-an-accountant,location-child,t-triage,BOFU,Service,yes,8,none,yes,Speak to a New York QuickBooks ProAdvisor · TechBrot,52,150,"Speak to a New York QuickBooks ProAdvisor &mdash; free, no sales pitch.",yes
/find-an-accountant/new-york/state-tax-notice-help/,find-an-accountant,location-child,t-triage,BOFU,Service,yes,8,none,yes,New York State Tax Notice Help · TechBrot,41,151,"Got a New York tax notice ? Read it right, then act.",yes
/find-an-accountant/new-york/urgent-bookkeeping/,find-an-accountant,location-child,t-triage,BOFU,Service,yes,7,none,yes,New York Urgent Bookkeeping · TechBrot,38,144,Behind on your books with a deadline bearing down?,yes
/find-an-accountant/new-york/virtual-bookkeeper/,find-an-accountant,location-child,t-money,BOFU,Service,yes,8,none,yes,New York Virtual Bookkeeper · TechBrot,38,154,"A New York virtual bookkeeper &mdash; in-house expertise, none of the overhead.",yes
/find-an-accountant/north-carolina/,find-an-accountant,state-pillar,t-state-pillar,BOFU,Service,yes,9,badge,yes,North Carolina QuickBooks ProAdvisors &amp; Bookkeeping,55,174,QuickBooks ProAdvisors &amp; Bookkeeping for North Carolina Businesses.,yes
/find-an-accountant/north-carolina/bookkeeping-services/,find-an-accountant,location-child,t-money,BOFU,Service,yes,7,badge,yes,North Carolina Bookkeeping Services · TechBrot,46,148,"North Carolina bookkeeping services &mdash; clean books, same bookkeeper, every month.",yes
/find-an-accountant/north-carolina/quickbooks-accountant/,find-an-accountant,location-child,t-money,BOFU,Service,yes,7,badge,yes,North Carolina QuickBooks Accountant &amp; ProAdvisor,53,154,"Your North Carolina QuickBooks accountant &mdash; ProAdvisor expertise, North Carolina rules.",yes
/find-an-accountant/north-carolina/quickbooks-cleanup/,find-an-accountant,location-child,t-money,BOFU,Service,yes,7,badge,yes,North Carolina QuickBooks Cleanup &amp; Catch-Up · TechBrot,59,154,When QuickBooks itself is the problem.,yes
/find-an-accountant/north-carolina/quickbooks-setup/,find-an-accountant,location-child,t-money,BOFU,Service,yes,7,badge,yes,North Carolina QuickBooks Setup &amp; Implementation,52,148,North Carolina QuickBooks setup done right from day one.,yes
/find-an-accountant/north-carolina/small-business-accountant/,find-an-accountant,location-child,t-money,BOFU,Service,yes,7,badge,yes,North Carolina Small Business Accountant · TechBrot,51,153,"Your North Carolina small business accountant, starting with the books.",yes
/find-an-accountant/ohio/,find-an-accountant,state-pillar,t-state-pillar,BOFU,Service,yes,9,badge,yes,Ohio QuickBooks ProAdvisors &amp; Bookkeeping,45,153,QuickBooks ProAdvisors &amp; Bookkeeping for Ohio Businesses.,yes
/find-an-accountant/ohio/bookkeeping-services/,find-an-accountant,location-child,t-money,BOFU,Service,yes,7,badge,yes,Ohio Bookkeeping Services · TechBrot,36,155,"Ohio bookkeeping services &mdash; clean books, same bookkeeper, every month.",yes
/find-an-accountant/ohio/quickbooks-accountant/,find-an-accountant,location-child,t-money,BOFU,Service,yes,7,badge,yes,Ohio QuickBooks Accountant &amp; ProAdvisor · TechBrot,54,157,"Your Ohio QuickBooks accountant &mdash; ProAdvisor expertise, Ohio rules.",yes
/find-an-accountant/ohio/quickbooks-cleanup/,find-an-accountant,location-child,t-money,BOFU,Service,yes,7,badge,yes,Ohio QuickBooks Cleanup &amp; Catch-Up · TechBrot,49,152,When QuickBooks itself is the problem.,yes
/find-an-accountant/ohio/quickbooks-setup/,find-an-accountant,location-child,t-money,BOFU,Service,yes,7,badge,yes,Ohio QuickBooks Setup &amp; Implementation,42,149,Ohio QuickBooks setup done right from day one.,yes
/find-an-accountant/ohio/small-business-accountant/,find-an-accountant,location-child,t-money,BOFU,Service,yes,7,badge,yes,Ohio Small Business Accountant · TechBrot,41,146,"Your Ohio small business accountant, starting with the books.",yes
/find-an-accountant/pennsylvania/,find-an-accountant,state-pillar,t-state-pillar,BOFU,Service,yes,9,badge,yes,Pennsylvania QuickBooks ProAdvisors &amp; Bookkeeping,53,158,QuickBooks ProAdvisors &amp; Bookkeeping for Pennsylvania Businesses.,yes
/find-an-accountant/pennsylvania/bookkeeping-services/,find-an-accountant,location-child,t-money,BOFU,Service,yes,7,badge,yes,Pennsylvania Bookkeeping Services · TechBrot,44,152,"Pennsylvania bookkeeping services &mdash; clean books, same bookkeeper, every month.",yes
/find-an-accountant/pennsylvania/quickbooks-accountant/,find-an-accountant,location-child,t-money,BOFU,Service,yes,7,badge,yes,Pennsylvania QuickBooks Accountant &amp; ProAdvisor · TechBrot,62,146,"Your Pennsylvania QuickBooks accountant &mdash; ProAdvisor expertise, Pennsylvania rules.",yes
/find-an-accountant/pennsylvania/quickbooks-cleanup/,find-an-accountant,location-child,t-money,BOFU,Service,yes,7,badge,yes,Pennsylvania QuickBooks Cleanup &amp; Catch-Up · TechBrot,57,155,When QuickBooks itself is the problem.,yes
/find-an-accountant/pennsylvania/quickbooks-setup/,find-an-accountant,location-child,t-money,BOFU,Service,yes,7,badge,yes,Pennsylvania QuickBooks Setup &amp; Implementation,50,150,Pennsylvania QuickBooks setup done right from day one.,yes
/find-an-accountant/pennsylvania/small-business-accountant/,find-an-accountant,location-child,t-money,BOFU,Service,yes,7,badge,yes,Pennsylvania Small Business Accountant · TechBrot,49,150,"Your Pennsylvania small business accountant, starting with the books.",yes
/find-an-accountant/tennessee/,find-an-accountant,state-pillar,t-state-pillar,BOFU,Service,yes,9,badge,yes,Tennessee QuickBooks ProAdvisors &amp; Bookkeeping,50,164,QuickBooks ProAdvisors &amp; Bookkeeping for Tennessee Businesses.,yes
/find-an-accountant/tennessee/bookkeeping-services/,find-an-accountant,location-child,t-money,BOFU,Service,yes,7,badge,yes,Tennessee Bookkeeping Services · TechBrot,41,152,"Tennessee bookkeeping services &mdash; clean books, same bookkeeper, every month.",yes
/find-an-accountant/tennessee/quickbooks-accountant/,find-an-accountant,location-child,t-money,BOFU,Service,yes,7,badge,yes,Tennessee QuickBooks Accountant &amp; ProAdvisor · TechBrot,59,149,"Your Tennessee QuickBooks accountant &mdash; ProAdvisor expertise, Tennessee rules.",yes
/find-an-accountant/tennessee/quickbooks-cleanup/,find-an-accountant,location-child,t-money,BOFU,Service,yes,7,badge,yes,Tennessee QuickBooks Cleanup &amp; Sales-Tax Fixes · TechBrot,61,162,When QuickBooks itself is the problem.,yes
/find-an-accountant/tennessee/quickbooks-setup/,find-an-accountant,location-child,t-money,BOFU,Service,yes,7,badge,yes,Tennessee QuickBooks Setup &amp; Implementation,47,162,Tennessee QuickBooks setup done right from day one.,yes
/find-an-accountant/tennessee/small-business-accountant/,find-an-accountant,location-child,t-money,BOFU,Service,yes,7,badge,yes,Tennessee Small Business Accountant · TechBrot,46,152,"Your Tennessee small business accountant, starting with the books.",yes
/find-an-accountant/texas/,find-an-accountant,state-pillar,t-state-pillar,BOFU,Service,yes,12,badge,yes,Texas QuickBooks ProAdvisors &amp; Bookkeeping · TechBrot,57,155,QuickBooks ProAdvisors &amp; Bookkeeping for Texas Businesses.,yes
/find-an-accountant/texas/bookkeeping-services/,find-an-accountant,location-child,t-location-child,BOFU,Service,yes,6,none,yes,Texas Bookkeeping Services · TechBrot,37,160,Texas bookkeeping that keeps the Comptroller&rsquo;s math clean.,yes
/find-an-accountant/texas/business-tax-problems/,find-an-accountant,location-child,t-location-child,BOFU,Service,yes,8,none,yes,Texas Business Tax Problems (Books First) · TechBrot,52,164,Most Texas &lsquo;tax problems&rsquo; start in the books.,yes
/find-an-accountant/texas/cities/,find-an-accountant,location-child,t-location,BOFU,CollectionPage,yes,6,none,yes,Texas Cities We Serve · Bookkeeping &amp; QuickBooks · TechBrot,63,156,A Texas bookkeeper for your city — and your city's economy.,yes
/find-an-accountant/texas/cities/austin/,find-an-accountant,location-child,t-location-child,BOFU,Service,yes,8,none,yes,Austin Bookkeeper &amp; QuickBooks Accountant · TechBrot,56,154,Austin bookkeeper &amp; QuickBooks accountant.,yes
/find-an-accountant/texas/cities/corpus-christi/,find-an-accountant,location-child,t-location-child,BOFU,Service,yes,8,none,yes,Corpus Christi Bookkeeper &amp; QuickBooks Accountant · TechBrot,64,159,Corpus Christi bookkeeper &amp; QuickBooks accountant.,yes
/find-an-accountant/texas/cities/dallas/,find-an-accountant,location-child,t-location-child,BOFU,Service,yes,8,none,yes,Dallas Bookkeeper &amp; QuickBooks Accountant · TechBrot,56,152,Dallas bookkeeper &amp; QuickBooks accountant.,yes
/find-an-accountant/texas/cities/el-paso/,find-an-accountant,location-child,t-location-child,BOFU,Service,yes,8,none,yes,El Paso Bookkeeper &amp; QuickBooks Accountant · TechBrot,57,160,El Paso bookkeeper &amp; QuickBooks accountant.,yes
/find-an-accountant/texas/cities/fort-worth/,find-an-accountant,location-child,t-location-child,BOFU,Service,yes,8,none,yes,Fort Worth Bookkeeper &amp; QuickBooks Accountant · TechBrot,60,157,Fort Worth bookkeeper &amp; QuickBooks accountant.,yes
/find-an-accountant/texas/cities/houston/,find-an-accountant,location-child,t-location-child,BOFU,Service,yes,8,none,yes,Houston Bookkeeper &amp; QuickBooks Accountant · TechBrot,57,161,Houston bookkeeper &amp; QuickBooks accountant.,yes
/find-an-accountant/texas/cities/killeen/,find-an-accountant,location-child,t-location-child,BOFU,Service,yes,8,none,yes,Killeen Bookkeeper &amp; QuickBooks Accountant · TechBrot,57,150,Killeen bookkeeper &amp; QuickBooks accountant.,yes
/find-an-accountant/texas/cities/laredo/,find-an-accountant,location-child,t-location-child,BOFU,Service,yes,9,none,yes,Laredo Bookkeeper &amp; QuickBooks Accountant · TechBrot,56,154,Laredo bookkeeper &amp; QuickBooks accountant.,yes
/find-an-accountant/texas/cities/lubbock/,find-an-accountant,location-child,t-location-child,BOFU,Service,yes,9,none,yes,Lubbock Bookkeeper &amp; QuickBooks Accountant · TechBrot,57,160,Lubbock bookkeeper &amp; QuickBooks accountant.,yes
/find-an-accountant/texas/cities/plano/,find-an-accountant,location-child,t-location-child,BOFU,Service,yes,8,none,yes,Plano Bookkeeper &amp; QuickBooks Accountant · TechBrot,55,156,Plano bookkeeper &amp; QuickBooks accountant.,yes
/find-an-accountant/texas/cities/san-antonio/,find-an-accountant,location-child,t-location-child,BOFU,Service,yes,8,none,yes,San Antonio Bookkeeper &amp; QuickBooks Accountant · TechBrot,61,160,San Antonio bookkeeper &amp; QuickBooks accountant.,yes
/find-an-accountant/texas/cleanup-bookkeeping/,find-an-accountant,location-child,t-location-child,BOFU,Service,yes,6,none,yes,Texas Cleanup &amp; Catch-Up Bookkeeping · TechBrot,51,150,Months &mdash; or years &mdash; behind on the books? We&rsquo;ll catch you up.,yes
/find-an-accountant/texas/franchise-tax-help/,find-an-accountant,location-child,t-location-child,BOFU,Service,yes,6,none,yes,Texas Franchise (Margin) Tax Help · TechBrot,44,155,"The Texas franchise tax, tracked in your books all year.",yes
/find-an-accountant/texas/industries/,find-an-accountant,location-child,t-location,BOFU,CollectionPage,yes,6,none,yes,Texas Industry-Specific Accounting · TechBrot,45,160,"Texas accounting, built for your industry.",yes
/find-an-accountant/texas/industries/construction/,find-an-accountant,location-child,t-location-child,BOFU,Service,yes,7,none,yes,Texas Construction Accounting &amp; Job Costing · TechBrot,58,160,Texas construction accounting that knows which job made money.,yes
/find-an-accountant/texas/industries/healthcare/,find-an-accountant,location-child,t-location-child,BOFU,Service,yes,7,none,yes,Texas Healthcare &amp; Medical Practice Accounting · TechBrot,61,155,Texas medical-practice accounting that reconciles what you&rsquo;re actually paid.,yes
/find-an-accountant/texas/industries/manufacturing/,find-an-accountant,location-child,t-location-child,BOFU,Service,yes,7,none,yes,Texas Manufacturing Accounting &amp; Cost Accounting · TechBrot,63,165,Texas manufacturing accounting that knows your true unit cost.,yes
/find-an-accountant/texas/industries/professional-services/,find-an-accountant,location-child,t-location-child,BOFU,Service,yes,7,none,yes,Texas Professional Services &amp; Law Firm Accounting · TechBrot,64,162,Texas professional-services accounting that shows which work pays.,yes
/find-an-accountant/texas/industries/real-estate/,find-an-accountant,location-child,t-location-child,BOFU,Service,yes,7,none,yes,Texas Real Estate Accounting &amp; Bookkeeping · TechBrot,57,161,Texas real estate accounting that keeps every entity straight.,yes
/find-an-accountant/texas/industries/trucking/,find-an-accountant,location-child,t-location-child,BOFU,Service,yes,7,none,yes,Texas Trucking &amp; Transportation Accounting · TechBrot,57,154,Texas trucking accounting that knows your cost per mile.,yes
/find-an-accountant/texas/monthly-bookkeeping/,find-an-accountant,location-child,t-location-child,BOFU,Service,yes,6,none,yes,Texas Monthly Bookkeeping · TechBrot,36,160,Monthly bookkeeping that closes the books every month.,yes
/find-an-accountant/texas/pricing/,find-an-accountant,location-child,t-prose,BOFU,Service,yes,6,badge,yes,Texas Bookkeeping &amp; QuickBooks Pricing · TechBrot,53,146,Fixed-fee Texas pricing — written scope before any work.,yes
/find-an-accountant/texas/quickbooks-accountant/,find-an-accountant,location-child,t-location-child,BOFU,Service,yes,8,none,yes,Texas QuickBooks Accountant &amp; ProAdvisor · TechBrot,55,155,"Your Texas QuickBooks accountant &mdash; ProAdvisor expertise, Texas rules.",yes
/find-an-accountant/texas/quickbooks-cleanup/,find-an-accountant,location-child,t-location-child,BOFU,Service,yes,7,none,yes,Texas QuickBooks Cleanup · TechBrot,35,150,"Texas QuickBooks cleanup, back to CPA-ready.",yes
/find-an-accountant/texas/quickbooks-error-fixes/,find-an-accountant,location-child,t-location-child,BOFU,Service,yes,6,none,yes,Texas QuickBooks Error Fixes · TechBrot,39,157,"Texas QuickBooks errors, traced to the root and fixed.",yes
/find-an-accountant/texas/quickbooks-migration/,find-an-accountant,location-child,t-location-child,BOFU,Service,yes,6,none,yes,Texas QuickBooks Migration · TechBrot,37,153,Texas QuickBooks migration without losing your history.,yes
/find-an-accountant/texas/quickbooks-reconciliation/,find-an-accountant,location-child,t-location-child,BOFU,Service,yes,6,none,yes,Texas QuickBooks Reconciliation · TechBrot,42,139,Texas QuickBooks reconciliation that actually ties.,yes
/find-an-accountant/texas/quickbooks-setup/,find-an-accountant,location-child,t-location-child,BOFU,Service,yes,7,none,yes,Texas QuickBooks Setup · TechBrot,33,156,"Texas QuickBooks setup, done right the first time.",yes
/find-an-accountant/texas/quickbooks-training/,find-an-accountant,location-child,t-location-child,BOFU,Service,yes,6,none,yes,Texas QuickBooks Training · TechBrot,36,157,"QuickBooks training for your Texas team, done your way.",yes
/find-an-accountant/texas/sales-tax-help/,find-an-accountant,location-child,t-location-child,BOFU,Service,yes,6,none,yes,Texas Sales Tax Help in QuickBooks · TechBrot,45,158,"Texas sales tax, set up right and reconciled every month.",yes
/find-an-accountant/texas/small-business-accountant/,find-an-accountant,location-child,t-location-child,BOFU,Service,yes,7,none,yes,Texas Small Business Accountant · TechBrot,42,161,A small business accountant who actually knows Texas.,yes
/find-an-accountant/texas/speak-to-a-proadvisor/,find-an-accountant,location-child,t-triage,BOFU,Service,yes,8,none,yes,Speak to a Texas QuickBooks ProAdvisor · TechBrot,49,147,"Speak to a Texas QuickBooks ProAdvisor &mdash; free, no sales pitch.",yes
/find-an-accountant/texas/urgent-bookkeeping/,find-an-accountant,location-child,t-location-child,BOFU,Service,yes,6,none,yes,Texas Urgent &amp; Fast-Turnaround Bookkeeping · TechBrot,57,156,A Texas deadline looming and the books not ready? Call us.,yes
/find-an-accountant/texas/virtual-bookkeeper/,find-an-accountant,location-child,t-location-child,BOFU,Service,yes,6,none,yes,Texas Virtual Bookkeeper · TechBrot,35,158,"A virtual bookkeeper for Texas &mdash; same expert, every month, anywhere in the state.",yes
/find-an-accountant/virginia/,find-an-accountant,state-pillar,t-state-pillar,BOFU,Service,yes,9,badge,yes,Virginia QuickBooks ProAdvisors &amp; Bookkeeping,49,146,QuickBooks ProAdvisors &amp; Bookkeeping for Virginia Businesses.,yes
/find-an-accountant/virginia/bookkeeping-services/,find-an-accountant,location-child,t-money,BOFU,Service,yes,7,badge,yes,Virginia Bookkeeping Services · TechBrot,40,155,"Virginia bookkeeping services &mdash; clean books, same bookkeeper, every month.",yes
/find-an-accountant/virginia/quickbooks-accountant/,find-an-accountant,location-child,t-money,BOFU,Service,yes,7,badge,yes,Virginia QuickBooks Accountant &amp; ProAdvisor · TechBrot,58,153,"Your Virginia QuickBooks accountant &mdash; ProAdvisor expertise, Virginia rules.",yes
/find-an-accountant/virginia/quickbooks-cleanup/,find-an-accountant,location-child,t-money,BOFU,Service,yes,7,badge,yes,Virginia QuickBooks Cleanup &amp; Catch-Up · TechBrot,53,154,When QuickBooks itself is the problem.,yes
/find-an-accountant/virginia/quickbooks-setup/,find-an-accountant,location-child,t-money,BOFU,Service,yes,7,badge,yes,Virginia QuickBooks Setup &amp; Implementation,46,153,Virginia QuickBooks setup done right from day one.,yes
/find-an-accountant/virginia/small-business-accountant/,find-an-accountant,location-child,t-money,BOFU,Service,yes,7,badge,yes,Virginia Small Business Accountant · TechBrot,45,145,"Your Virginia small business accountant, starting with the books.",yes
/find-an-accountant/washington/,find-an-accountant,state-pillar,t-state-pillar,BOFU,Service,yes,9,badge,yes,Washington QuickBooks ProAdvisors &amp; Bookkeeping,51,171,QuickBooks ProAdvisors &amp; Bookkeeping for Washington Businesses.,yes
