url,silo,page_type,template,funnel_stage,schema_type,has_faq,faq_count,trust_strip,reviewed_by_david,title,title_len,meta_desc_len,h1,in_sitemap
/find-an-accountant/washington/bookkeeping-services/,find-an-accountant,location-child,t-money,BOFU,Service,yes,7,badge,yes,Washington Bookkeeping Services · TechBrot,42,157,"Washington bookkeeping services &mdash; clean books, same bookkeeper, every month.",yes
/find-an-accountant/washington/quickbooks-accountant/,find-an-accountant,location-child,t-money,BOFU,Service,yes,7,badge,yes,Washington QuickBooks Accountant &amp; ProAdvisor · TechBrot,60,158,"Your Washington QuickBooks accountant &mdash; ProAdvisor expertise, Washington rules.",yes
/find-an-accountant/washington/quickbooks-cleanup/,find-an-accountant,location-child,t-money,BOFU,Service,yes,7,badge,yes,Washington QuickBooks Cleanup &amp; B&amp;O Fixes · TechBrot,60,160,When QuickBooks itself is the problem.,yes
/find-an-accountant/washington/quickbooks-setup/,find-an-accountant,location-child,t-money,BOFU,Service,yes,7,badge,yes,Washington QuickBooks Setup &amp; Implementation,48,169,Washington QuickBooks setup done right from day one.,yes
/find-an-accountant/washington/small-business-accountant/,find-an-accountant,location-child,t-money,BOFU,Service,yes,7,badge,yes,Washington Small Business Accountant · TechBrot,47,155,"Your Washington small business accountant, starting with the books.",yes
/frameworks/,frameworks,hub,t-hub,MOFU,CollectionPage,no,0,none,no,TechBrot Frameworks · How We Diagnose the Work,46,153,How we name and diagnose the work.,yes
/frameworks/compounding-reconciliation-drift/,frameworks,framework,t-guide,TOFU,DefinedTerm,yes,8,none,no,Compounding Reconciliation Drift · TechBrot Framework,53,163,Compounding Reconciliation Drift,yes
/frameworks/historical-accounting-debt/,frameworks,framework,t-guide,TOFU,DefinedTerm,yes,8,none,no,Historical Accounting Debt — TechBrot Framework · TechBrot,58,160,Historical Accounting Debt,yes
/frameworks/migration-integrity-protocol/,frameworks,framework,t-guide,TOFU,DefinedTerm,yes,8,none,no,Migration Integrity Protocol · QuickBooks Framework,51,142,Migration Integrity Protocol,yes
/frameworks/techbrot-setup-protocol/,frameworks,framework,t-guide,TOFU,DefinedTerm,yes,8,none,no,TechBrot Setup Protocol · QuickBooks Setup Framework,52,156,TechBrot Setup Protocol,yes
/glossary/,glossary,faq-hub,t-hub,TOFU,CollectionPage,no,0,none,no,Accounting &amp; QuickBooks Glossary — Plain-English Terms,58,151,The accounting &amp; QuickBooks glossary.,yes
/glossary/1099-nec/,glossary,glossary-term,t-glossary,TOFU,DefinedTerm,no,0,none,no,Form 1099-NEC: Reporting Contractor Pay,39,159,Form 1099-NEC,yes
/glossary/1099-vs-w2/,glossary,glossary-term,t-glossary,TOFU,DefinedTerm,no,0,none,no,1099 vs. W-2: Worker Classification · TechBrot,46,159,1099 vs. W-2,yes
/glossary/accounts-payable/,glossary,glossary-term,t-glossary,TOFU,DefinedTerm,no,0,none,no,Accounts Payable (AP): What Your Business Owes,46,154,Accounts payable,yes
/glossary/accounts-receivable/,glossary,glossary-term,t-glossary,TOFU,DefinedTerm,no,0,none,no,Accounts Receivable (AR): Money Owed to You,43,154,Accounts receivable,yes
/glossary/accrual-vs-cash-basis-accounting/,glossary,glossary-term,t-glossary,TOFU,DefinedTerm,no,0,none,no,Accrual vs. Cash Basis Accounting · TechBrot,44,155,Accrual vs. cash basis accounting,yes
/glossary/accrued-expenses/,glossary,glossary-term,t-glossary,TOFU,DefinedTerm,no,0,none,no,Accrued Expenses: Incurred but Not Yet Paid,43,159,Accrued expenses,yes
/glossary/amortization/,glossary,glossary-term,t-glossary,TOFU,DefinedTerm,no,0,none,no,Amortization: Spreading a Cost Over Time,40,157,Amortization,yes
/glossary/audit-trail/,glossary,glossary-term,t-glossary,TOFU,DefinedTerm,no,0,none,no,Audit Trail in QuickBooks: The Change Log,41,158,Audit trail,yes
/glossary/balance-sheet/,glossary,glossary-term,t-glossary,TOFU,DefinedTerm,no,0,none,no,"Balance Sheet: Assets, Liabilities &amp; Equity",47,157,Balance sheet,yes
/glossary/bank-feeds/,glossary,glossary-term,t-glossary,TOFU,DefinedTerm,no,0,none,no,Bank Feeds in QuickBooks: Auto-Import · TechBrot,48,159,Bank feeds,yes
/glossary/bank-reconciliation/,glossary,glossary-term,t-glossary,TOFU,DefinedTerm,yes,6,none,no,Bank Reconciliation: Match Books to Bank · TechBrot,51,160,Bank reconciliation,yes
/glossary/bookkeeping-vs-accounting/,glossary,glossary-term,t-glossary,TOFU,DefinedTerm,no,0,none,no,Bookkeeping vs. Accounting: The Difference,42,154,Bookkeeping vs. accounting,yes
/glossary/cash-flow-statement/,glossary,glossary-term,t-glossary,TOFU,DefinedTerm,no,0,none,no,Cash Flow Statement: Where Cash Moved · TechBrot,48,155,Cash flow statement,yes
/glossary/catch-up-bookkeeping/,glossary,glossary-term,t-glossary,TOFU,DefinedTerm,no,0,none,no,Catch-Up Bookkeeping: Get Behind Books Current,46,158,Catch-up bookkeeping,yes
/glossary/certified-quickbooks-proadvisor/,glossary,glossary-term,t-glossary,TOFU,DefinedTerm,yes,6,none,no,Certified QuickBooks ProAdvisor: What It Means,46,160,Certified QuickBooks ProAdvisor,yes
/glossary/chart-of-accounts/,glossary,glossary-term,t-glossary,TOFU,DefinedTerm,no,0,none,no,Chart of Accounts: How Your Books Are Organized,47,159,Chart of accounts,yes
/glossary/class-tracking/,glossary,glossary-term,t-glossary,TOFU,DefinedTerm,no,0,none,no,Class Tracking in QuickBooks · TechBrot,39,163,Class tracking,yes
/glossary/cost-of-goods-sold/,glossary,glossary-term,t-glossary,TOFU,DefinedTerm,no,0,none,no,Cost of Goods Sold (COGS): Direct Costs · TechBrot,50,160,Cost of goods sold,yes
/glossary/deferred-revenue/,glossary,glossary-term,t-glossary,TOFU,DefinedTerm,no,0,none,no,Deferred Revenue: Paid Before You Deliver,41,158,Deferred revenue,yes
/glossary/depreciation/,glossary,glossary-term,t-glossary,TOFU,DefinedTerm,no,0,none,no,Depreciation: Spreading an Asset’s Cost · TechBrot,50,156,Depreciation,yes
/glossary/double-entry-accounting/,glossary,glossary-term,t-glossary,TOFU,DefinedTerm,no,0,none,no,Double-Entry Accounting: Debits &amp; Credits · TechBrot,56,152,Double-entry accounting,yes
/glossary/ein/,glossary,glossary-term,t-glossary,TOFU,DefinedTerm,no,0,none,no,EIN: Your Business Federal Tax ID · TechBrot,44,151,Employer Identification Number (EIN),yes
/glossary/estimated-taxes/,glossary,glossary-term,t-glossary,TOFU,DefinedTerm,no,0,none,no,Estimated Taxes: Pay-As-You-Go Payments,39,158,Estimated taxes,yes
/glossary/fiscal-year/,glossary,glossary-term,t-glossary,TOFU,DefinedTerm,no,0,none,no,Fiscal Year: Your 12-Month Accounting Period,44,156,Fiscal year,yes
/glossary/fixed-assets/,glossary,glossary-term,t-glossary,TOFU,DefinedTerm,no,0,none,no,Fixed Assets: Long-Lived Property You Use,41,159,Fixed assets,yes
/glossary/fractional-cfo/,glossary,glossary-term,t-glossary,TOFU,DefinedTerm,no,0,none,no,Fractional CFO: Part-Time Financial Leadership,46,158,Fractional CFO,yes
/glossary/general-ledger/,glossary,glossary-term,t-glossary,TOFU,DefinedTerm,no,0,none,no,General Ledger: The Master Record · TechBrot,44,157,General ledger,yes
/glossary/gross-margin/,glossary,glossary-term,t-glossary,TOFU,DefinedTerm,no,0,none,no,Gross Margin: Profit Per Sales Dollar · TechBrot,48,153,Gross margin,yes
/glossary/journal-entry/,glossary,glossary-term,t-glossary,TOFU,DefinedTerm,no,0,none,no,Journal Entry: The Record of a Transaction,42,156,Journal entry,yes
/glossary/memorized-transaction/,glossary,glossary-term,t-glossary,TOFU,DefinedTerm,no,0,none,no,Memorized Transaction in QuickBooks · TechBrot,46,152,Memorized transaction,yes
/glossary/month-end-close/,glossary,glossary-term,t-glossary,TOFU,DefinedTerm,no,0,none,no,Month-End Close: Finalizing the Books · TechBrot,48,160,Month-end close,yes
/glossary/net-income/,glossary,glossary-term,t-glossary,TOFU,DefinedTerm,no,0,none,no,Net Income: The Bottom Line · TechBrot,38,157,Net income,yes
/glossary/opening-balance/,glossary,glossary-term,t-glossary,TOFU,DefinedTerm,no,0,none,no,Opening Balance: Where an Account Starts · TechBrot,51,157,Opening balance,yes
/glossary/operating-expenses/,glossary,glossary-term,t-glossary,TOFU,DefinedTerm,no,0,none,no,Operating Expenses (OpEx): Cost to Run · TechBrot,49,157,Operating expenses,yes
/glossary/owners-draw/,glossary,glossary-term,t-glossary,TOFU,DefinedTerm,no,0,none,no,Owner’s Draw: Taking Money Out · TechBrot,41,153,Owner&rsquo;s draw,yes
/glossary/owners-equity/,glossary,glossary-term,t-glossary,TOFU,DefinedTerm,no,0,none,no,Owner’s Equity: The Owner’s Stake · TechBrot,44,157,Owner&rsquo;s equity,yes
/glossary/payroll-liabilities/,glossary,glossary-term,t-glossary,TOFU,DefinedTerm,no,0,none,no,Payroll Liabilities: What You Owe the Agencies,46,158,Payroll liabilities,yes
/glossary/prepaid-expenses/,glossary,glossary-term,t-glossary,TOFU,DefinedTerm,no,0,none,no,"Prepaid Expenses: Paid Ahead, Used Later",40,158,Prepaid expenses,yes
/glossary/profit-and-loss-statement/,glossary,glossary-term,t-glossary,TOFU,DefinedTerm,no,0,none,no,Profit and Loss Statement (P&amp;L) · TechBrot,46,163,Profit and loss statement,yes
/glossary/retained-earnings/,glossary,glossary-term,t-glossary,TOFU,DefinedTerm,no,0,none,no,Retained Earnings: Profit the Business Kept,43,154,Retained earnings,yes
/glossary/sales-tax-nexus/,glossary,glossary-term,t-glossary,TOFU,DefinedTerm,yes,6,none,no,Sales Tax Nexus: When You Must Collect · TechBrot,49,160,Sales tax nexus,yes
/glossary/trial-balance/,glossary,glossary-term,t-glossary,TOFU,DefinedTerm,no,0,none,no,Trial Balance: Do Debits Equal Credits? · TechBrot,50,156,Trial balance,yes
/glossary/undeposited-funds/,glossary,glossary-term,t-glossary,TOFU,DefinedTerm,no,0,none,no,Undeposited Funds: The QuickBooks Holding Account,49,155,Undeposited Funds,yes
/glossary/w-9-form/,glossary,glossary-term,t-glossary,TOFU,DefinedTerm,no,0,none,no,Form W-9: Collect a Vendor’s Tax ID · TechBrot,46,153,Form W-9,yes
/glossary/working-capital/,glossary,glossary-term,t-glossary,TOFU,DefinedTerm,no,0,none,no,Working Capital: Your Short-Term Cushion,40,156,Working capital,yes
/glossary/write-off/,glossary,glossary-term,t-glossary,TOFU,DefinedTerm,no,0,none,no,Write-Off: Removing What Has No Value,37,160,Write-off,yes
/legal/disclaimer/,legal,legal,t-prose,MOFU,WebPage,no,0,none,no,"Disclaimer · Scope, Trademark &amp; Independence · TechBrot",59,154,Disclaimer,yes
/legal/dpa/,legal,legal,t-prose,MOFU,WebPage,no,0,none,no,Data Processing Terms · How We Handle Client Data · TechBrot,60,148,Data Processing Terms,yes
/legal/privacy-policy/,legal,legal,t-prose,MOFU,WebPage,no,0,none,no,Privacy Policy · How TechBrot Handles Your Data · TechBrot,58,144,Privacy Policy,yes
/legal/terms/,legal,legal,t-prose,MOFU,WebPage,no,0,none,no,Terms of Service · Website Use &amp; Conditions · TechBrot,58,136,Terms of Service,yes
/partners/,partners,prose,t-prose,MOFU,FAQPage,yes,19,none,yes,For Independent ProAdvisors · Join TechBrot,43,138,Your practice. Our platform. The economics of both.,yes
/partners/faq/,partners,faq-hub,t-prose,TOFU,CollectionPage,yes,7,none,yes,Operator Network FAQ: For Certified ProAdvisors · TechBrot,58,154,"The operator network, answered.",yes
/platforms/,platforms,hub,t-hub,MOFU,CollectionPage,yes,8,badge,no,Platforms We&#39;re Certified On · TechBrot,43,164,The platforms we're certified on.,yes
/platforms/quickbooks/,platforms,prose,t-prose,MOFU,Service,yes,8,none,no,QuickBooks: Our Platform Certification · TechBrot,49,207,QuickBooks: our primary platform certification.,yes
/pricing/,pricing,pricing,t-prose,BOFU,Service,yes,7,badge,no,Fixed-Fee Bookkeeping &amp; QuickBooks Pricing · TechBrot,57,150,Fixed-fee pricing. Written scope before any work.,yes
/pricing/bookkeeping/,pricing,pricing,t-prose,BOFU,Service,yes,8,badge,no,Monthly Bookkeeping Cost · Fixed-Fee Tiers,42,160,"Monthly bookkeeping pricing, by the tier.",yes
/pricing/cfo/,pricing,pricing,t-prose,BOFU,Service,yes,8,badge,no,Fractional CFO Cost &amp; Pricing · TechBrot,44,156,"Fractional CFO pricing. A senior retainer, scoped to the work.",yes
/pricing/cleanup/,pricing,pricing,t-prose,BOFU,Service,yes,8,badge,no,Bookkeeping Cleanup &amp; Catch-Up Cost · TechBrot,50,150,What cleanup and catch-up actually cost.,yes
/pricing/payroll/,pricing,pricing,t-prose,BOFU,Service,yes,8,badge,no,Payroll Management Cost — Fixed Monthly Fee · TechBrot,54,153,"What payroll management costs, and what drives the fee.",yes
/pricing/quickbooks-setup/,pricing,pricing,t-prose,BOFU,Service,yes,8,badge,no,"QuickBooks Setup Cost · Fixed Fee $750–$5,000+",46,149,What a QuickBooks setup costs &mdash; and what moves the number.,yes
/quickbooks/,quickbooks,hub,t-hub,MOFU,Service,yes,10,badge,no,QuickBooks ProAdvisor Services for Small Businesses,51,140,Independent ProAdvisor services across the full QuickBooks stack.,yes
/quickbooks/bookkeeping-services/,quickbooks,prose,t-prose,MOFU,Service,yes,7,badge,no,QuickBooks Bookkeeping Services by a Certified ProAdvisor,57,150,"Your bookkeeping, done inside your own QuickBooks file.",yes
/quickbooks/cleanup/,quickbooks,money/service,t-money,BOFU,Service,yes,7,badge,yes,QuickBooks File Cleanup by Certified ProAdvisors · TechBrot,59,150,When QuickBooks itself is the problem.,yes
/quickbooks/cleanup/accountant-review/,quickbooks,prose,t-prose,MOFU,Service,yes,8,badge,yes,QuickBooks File Review: Honest Second Opinion,45,157,A ProAdvisor review of your QuickBooks file &mdash; an honest second opinion.,yes
/quickbooks/cleanup/after-prior-bookkeeper/,quickbooks,prose,t-prose,MOFU,Service,yes,8,badge,yes,QuickBooks Cleanup After a Prior Bookkeeper · TechBrot,54,151,QuickBooks cleanup after a prior bookkeeper.,yes
/quickbooks/cleanup/before-monthly-bookkeeping/,quickbooks,prose,t-prose,MOFU,Service,yes,8,badge,yes,QuickBooks Cleanup Before Monthly Bookkeeping,45,157,QuickBooks cleanup before monthly bookkeeping: why it comes first.,yes
/quickbooks/cleanup/cleanup-vs-reconciliation/,quickbooks,prose,t-prose,MOFU,Service,yes,8,badge,yes,QuickBooks Cleanup vs Reconciliation: Which You Need,52,152,QuickBooks cleanup vs reconciliation: which do you need?,yes
/quickbooks/cleanup/complex/,quickbooks,prose,t-prose,MOFU,Service,yes,8,badge,yes,Complex QuickBooks Cleanup: Multi-Year &amp; Structural,55,147,"Complex QuickBooks cleanup: multi-year, structural, multi-entity.",yes
/quickbooks/cleanup/focused/,quickbooks,prose,t-prose,MOFU,Service,yes,8,badge,yes,"Focused QuickBooks Cleanup: Single Issue, $1,200–$3,000",55,158,"Focused QuickBooks cleanup: one contained issue, fixed.",yes
/quickbooks/cleanup/forcing-reconciliation-risks/,quickbooks,prose,t-prose,MOFU,Service,yes,8,badge,yes,Risks of Forcing a QuickBooks Reconciliation,44,158,The risks of forcing a reconciliation.,yes
/quickbooks/cleanup/prior-owner-setup-issues/,quickbooks,prose,t-prose,MOFU,Service,yes,8,badge,yes,QuickBooks Cleanup After Buying a Business,42,160,QuickBooks cleanup after buying a business.,yes
/quickbooks/cleanup/standard/,quickbooks,prose,t-prose,MOFU,Service,yes,8,badge,yes,"Standard QuickBooks Cleanup: Multi-Issue, $3,000–$7,500",55,149,"Standard QuickBooks cleanup: multi-issue, brought to CPA-ready.",yes
/quickbooks/cleanup/structural-issues/,quickbooks,prose,t-prose,MOFU,Service,yes,8,badge,yes,QuickBooks Structural Issues: Fix a Broken File,47,160,QuickBooks structural issues: fixing a broken file structure.,yes
/quickbooks/cleanup/undeposited-funds/,quickbooks,prose,t-prose,MOFU,Service,yes,8,badge,yes,QuickBooks Undeposited Funds Cleanup: Fix the Pileup,52,150,QuickBooks Undeposited Funds cleanup: fix the pileup.,yes
/quickbooks/compare/,quickbooks,hub,t-hub,MOFU,CollectionPage,yes,9,badge,no,QuickBooks Comparisons: Fair Reviews by ProAdvisors,51,155,"Choosing accounting software is a fit decision, not a winner-takes-all.",yes
/quickbooks/compare/online-plans/,quickbooks,comparison,t-comparison,BOFU,CollectionPage,yes,7,badge,no,"QuickBooks Online Plans Compared, Tier by Tier",46,158,"QuickBooks Online plans compared, tier by tier.",yes
/quickbooks/compare/online-vs-desktop/,quickbooks,comparison,t-comparison,BOFU,CollectionPage,yes,6,badge,no,QuickBooks Online vs Desktop: Honest 2026 Comparison,52,160,"QuickBooks Online vs QuickBooks Desktop. An honest, current comparison.",yes
/quickbooks/compare/quickbooks-vs-freshbooks/,quickbooks,comparison,t-comparison,BOFU,CollectionPage,yes,6,badge,no,QuickBooks Online vs FreshBooks: Fair 2026 Comparison,53,156,"QuickBooks Online vs FreshBooks. A fair, useful comparison.",yes
/quickbooks/compare/quickbooks-vs-sage/,quickbooks,comparison,t-comparison,BOFU,CollectionPage,yes,6,badge,no,QuickBooks Online vs Sage: A Fair 2026 Comparison · TechBrot,60,151,"QuickBooks Online vs Sage. An honest, fair comparison.",yes
/quickbooks/compare/quickbooks-vs-wave/,quickbooks,comparison,t-comparison,BOFU,CollectionPage,yes,6,badge,no,QuickBooks Online vs Wave: A Fair 2026 Comparison · TechBrot,60,161,QuickBooks Online vs Wave. A fair comparison.,yes
/quickbooks/compare/quickbooks-vs-xero/,quickbooks,comparison,t-comparison,BOFU,CollectionPage,yes,6,badge,no,QuickBooks Online vs Xero: A Fair 2026 Comparison · TechBrot,60,154,QuickBooks Online vs Xero. A fair comparison.,yes
/quickbooks/compare/quickbooks-vs-zoho-books/,quickbooks,comparison,t-comparison,BOFU,CollectionPage,yes,6,badge,no,QuickBooks Online vs Zoho Books: Fair 2026 Comparison,53,157,QuickBooks Online vs Zoho Books. A fair comparison.,yes
/quickbooks/consulting/,quickbooks,prose,t-prose,MOFU,Service,yes,6,badge,no,QuickBooks Consulting: Certified ProAdvisor Advisory,52,156,A Certified ProAdvisor embedded in your workflow.,yes
/quickbooks/desktop/,quickbooks,prose,t-prose,MOFU,CollectionPage,yes,8,none,no,QuickBooks Desktop: Independent ProAdvisor Guide · TechBrot,59,158,"QuickBooks Desktop, read honestly.",yes
/quickbooks/desktop/hosting/,quickbooks,prose,t-prose,MOFU,Service,yes,7,none,yes,Hosting QuickBooks Desktop in the Cloud,39,149,Hosting QuickBooks Desktop in the cloud: what to know.,yes
/quickbooks/desktop/multi-user-setup/,quickbooks,prose,t-prose,MOFU,Service,yes,8,none,yes,QuickBooks Desktop Multi-User Setup: Step by Step · TechBrot,60,152,QuickBooks Desktop multi-user setup: step by step.,yes
/quickbooks/desktop/support-end-dates/,quickbooks,prose,t-prose,MOFU,Service,yes,8,none,yes,QuickBooks Desktop Support End Dates Explained,46,157,QuickBooks Desktop support end dates: what discontinuation means &amp; what to do.,yes
/quickbooks/enterprise/,quickbooks,prose,t-prose,MOFU,CollectionPage,yes,8,none,no,QuickBooks Enterprise: Independent ProAdvisor Guide,51,159,QuickBooks for the mid-market. The one Intuit still builds.,yes
/quickbooks/enterprise/features/,quickbooks,prose,t-prose,MOFU,Service,yes,8,none,yes,"QuickBooks Enterprise Features: Inventory, Pricing &amp; More",61,159,"QuickBooks Enterprise features: Advanced Inventory, Pricing &amp; more.",yes
/quickbooks/enterprise/hosting-cloud/,quickbooks,prose,t-prose,MOFU,Service,yes,8,none,yes,QuickBooks Enterprise Cloud Access &amp; Hosting · TechBrot,59,160,QuickBooks Enterprise cloud access &amp; hosting.,yes
/quickbooks/enterprise/industries/,quickbooks,prose,t-prose,MOFU,Service,yes,8,none,yes,QuickBooks Enterprise Industry Editions Explained · TechBrot,60,155,"QuickBooks Enterprise industry editions, explained.",yes
/quickbooks/enterprise/pricing/,quickbooks,prose,t-prose,MOFU,Service,yes,8,none,yes,QuickBooks Enterprise Pricing: What Drives the Cost,51,160,QuickBooks Enterprise pricing: what actually drives the cost.,yes
/quickbooks/faq/,quickbooks,faq-hub,t-prose,TOFU,CollectionPage,yes,35,none,yes,QuickBooks FAQ: 35 Questions Answered by ProAdvisors,52,156,"QuickBooks, answered.",yes
/quickbooks/file-review/,quickbooks,file-review,t-prose,BOFU,Service,yes,7,none,no,Free QuickBooks File Review · TechBrot,38,148,"Get your QuickBooks file reviewed — free, by a Certified ProAdvisor.",yes
/quickbooks/help/,quickbooks,hub,t-hub,MOFU,Service,yes,8,none,no,QuickBooks Help from Certified ProAdvisors,42,158,"QuickBooks help, delivered by ProAdvisors.",yes
/quickbooks/help/1099-errors/,quickbooks,prose,t-prose,MOFU,Service,yes,8,none,no,QuickBooks 1099 Errors: Missing Vendors &amp; Wrong Amounts,59,149,QuickBooks 1099 errors: missing vendors &amp; wrong amounts.,yes
/quickbooks/help/account-locked/,quickbooks,prose,t-prose,MOFU,Service,yes,8,none,no,QuickBooks Account Locked? Why &amp; How to Unlock It · TechBrot,64,159,QuickBooks account locked: why it happens &amp; how to unlock it.,yes
/quickbooks/help/admin-password-reset/,quickbooks,prose,t-prose,MOFU,Service,yes,8,none,no,QuickBooks Admin Password Reset (Desktop &amp; Online),54,149,How to reset your QuickBooks admin password.,yes
/quickbooks/help/after-hours-help/,quickbooks,prose,t-prose,MOFU,Service,yes,8,none,no,"After-Hours QuickBooks Help: Start Now, Reviewed Next Day",57,152,"After-hours QuickBooks help: start now, reviewed next business day.",yes
/quickbooks/help/backup-restore/,quickbooks,prose,t-prose,MOFU,Service,yes,8,none,no,"QuickBooks Backup &amp; Restore: Do It Right, Fix Failures",58,151,QuickBooks backup &amp; restore: how to do it right.,yes
/quickbooks/help/bank-feed-disconnected/,quickbooks,prose,t-prose,MOFU,Service,yes,8,none,no,QuickBooks Bank Feed Disconnected? Reconnect &amp; Stop It,58,155,QuickBooks bank feed disconnected: reconnect &amp; stop it recurring.,yes
/quickbooks/help/bank-feeds-not-working/,quickbooks,prose,t-prose,MOFU,Service,yes,8,none,no,QuickBooks Bank Feeds Not Working: Causes &amp; Fixes · TechBrot,64,159,QuickBooks bank feeds not working: causes &amp; fixes.,yes
/quickbooks/help/bank-rules-not-working/,quickbooks,prose,t-prose,MOFU,Service,yes,8,none,no,QuickBooks Bank Rules Not Working: Causes &amp; Fixes · TechBrot,64,153,QuickBooks bank rules not working: causes &amp; how to fix them.,yes
/quickbooks/help/books-not-ready-for-accountant/,quickbooks,prose,t-prose,MOFU,Service,yes,8,none,no,QuickBooks Books Not Ready for Your Accountant? · TechBrot,58,163,Your CPA says the books aren&rsquo;t ready to file? Get them CPA-ready.,yes
/quickbooks/help/cant-login/,quickbooks,prose,t-prose,MOFU,Service,yes,7,none,no,Can&#39;t Log In to QuickBooks? Causes &amp; How to Get Back In,63,161,Can&rsquo;t log in to QuickBooks: causes &amp; how to get back in.,yes
/quickbooks/help/cant-reach-intuit/,quickbooks,prose,t-prose,MOFU,Service,yes,7,none,no,Can&#39;t Reach QuickBooks Support? Contact Intuit &amp; Options,64,158,Can&rsquo;t reach QuickBooks support? Here&rsquo;s how to contact Intuit &mdash; and the independent option.,yes
/quickbooks/help/data-recovery/,quickbooks,prose,t-prose,MOFU,Service,yes,8,none,no,QuickBooks Data Recovery: Recover Lost or Damaged Data,54,153,QuickBooks data recovery: how to recover lost or damaged data.,yes
/quickbooks/help/direct-deposit-pending/,quickbooks,prose,t-prose,MOFU,Service,yes,8,none,no,QuickBooks Direct Deposit Pending? Why &amp; What to Check,58,164,QuickBooks direct deposit pending: why it&rsquo;s delayed &amp; what to check.,yes
/quickbooks/help/duplicate-transactions/,quickbooks,prose,t-prose,MOFU,Service,yes,8,none,no,Duplicate Transactions in QuickBooks: Causes &amp; Fixes,56,158,Duplicate transactions in QuickBooks: causes &amp; how to fix them.,yes
/quickbooks/help/emergency-help/,quickbooks,prose,t-triage,MOFU,Service,yes,8,none,no,Emergency QuickBooks Help: Broken File or Deadline?,51,164,Emergency QuickBooks help: a broken file or a deadline.,yes
/quickbooks/help/error-codes/,quickbooks,hub,t-hub,MOFU,CollectionPage,yes,7,none,no,QuickBooks Error Codes: Complete ProAdvisor Reference,53,156,"QuickBooks error codes, explained by ProAdvisors.",yes
/quickbooks/help/error-codes/12002/,quickbooks,error-code,t-prose,TOFU,Service,yes,7,none,no,QuickBooks Error 12002: Update Timeout Causes &amp; Fixes,57,154,QuickBooks Error 12002: update timeout causes &amp; fixes.,yes
/quickbooks/help/error-codes/12007/,quickbooks,error-code,t-prose,TOFU,Service,yes,7,none,no,QuickBooks Error 12007: Update Connection Causes &amp; Fixes,60,156,QuickBooks Error 12007: update connection causes &amp; fixes.,yes
/quickbooks/help/error-codes/12029/,quickbooks,error-code,t-prose,TOFU,Service,yes,7,none,no,QuickBooks Error 12029: Update Timeout Causes &amp; Fixes,57,153,QuickBooks Error 12029: update timeout causes &amp; fixes.,yes
/quickbooks/help/error-codes/15223/,quickbooks,error-code,t-prose,TOFU,Service,yes,8,none,no,QuickBooks Error 15223: Update/Payroll Causes &amp; Fixes,57,160,QuickBooks Error 15223: update/payroll causes &amp; fixes.,yes
/quickbooks/help/error-codes/15240/,quickbooks,error-code,t-prose,TOFU,Service,yes,7,none,no,QuickBooks Error 15240: Payroll Update Fix · TechBrot,53,157,QuickBooks Error 15240: payroll update won&rsquo;t download.,yes
/quickbooks/help/error-codes/15271/,quickbooks,error-code,t-prose,TOFU,Service,yes,7,none,no,QuickBooks Error 15271: Update Did Not Complete - Fixes,55,166,QuickBooks Error 15271: the update did not complete.,yes
/quickbooks/help/error-codes/3371/,quickbooks,error-code,t-prose,TOFU,Service,yes,7,none,no,QuickBooks Error 3371: License Validation Fix · TechBrot,56,156,QuickBooks Error 3371: license validation failed.,yes
/quickbooks/help/error-codes/6000-301/,quickbooks,error-code,t-prose,TOFU,Service,yes,7,none,no,"QuickBooks Error 6000, 301: Causes &amp; How to Fix It",54,156,"QuickBooks Error 6000, 301: causes &amp; how to fix it.",yes
/quickbooks/help/error-codes/6000-83/,quickbooks,error-code,t-prose,TOFU,Service,yes,7,none,no,QuickBooks Error 6000 83: Causes &amp; How to Fix It · TechBrot,63,152,"QuickBooks Error 6000, 83: causes &amp; how to fix it.",yes
/quickbooks/help/error-codes/6000/,quickbooks,error-code,t-prose,TOFU,Service,yes,7,none,no,QuickBooks Error 6000 (Series): Causes &amp; How to Fix It,58,155,QuickBooks Error 6000: causes &amp; how to fix it.,yes
