url,silo,page_type,template,funnel_stage,schema_type,has_faq,faq_count,trust_strip,reviewed_by_david,title,title_len,meta_desc_len,h1,in_sitemap
/find-an-accountant/illinois/,find-an-accountant,state-pillar,t-state-pillar,BOFU,Service,yes,12,badge,yes,Illinois QuickBooks ProAdvisors &amp; Bookkeeping · TechBrot,60,150,QuickBooks ProAdvisors &amp; Bookkeeping for Illinois Businesses.,yes
/find-an-accountant/illinois/bookkeeping-services/,find-an-accountant,location-child,t-location-child,BOFU,Service,yes,6,none,yes,Illinois Bookkeeping Services · TechBrot,40,158,Illinois bookkeeping that keeps the IDOR&rsquo;s math clean.,yes
/find-an-accountant/illinois/business-tax-problems/,find-an-accountant,location-child,t-location-child,BOFU,Service,yes,8,none,yes,Illinois Business Tax Problems (Books First) · TechBrot,55,156,Most Illinois &lsquo;tax problems&rsquo; start in the books.,yes
/find-an-accountant/illinois/cities/,find-an-accountant,location-child,t-location,BOFU,CollectionPage,yes,6,none,yes,Illinois Bookkeeper by City · TechBrot,38,158,"An Illinois bookkeeper for your city — where the city can change the tax picture, not just the economy.",yes
/find-an-accountant/illinois/cities/aurora/,find-an-accountant,location-child,t-location-child,BOFU,Service,yes,8,none,yes,Aurora Bookkeeper &amp; QuickBooks Accountant · TechBrot,56,149,Aurora bookkeeper &amp; QuickBooks accountant.,yes
/find-an-accountant/illinois/cities/bloomington/,find-an-accountant,location-child,t-location-child,BOFU,Service,yes,10,none,yes,Bloomington Bookkeeper &amp; QuickBooks Accountant · TechBrot,61,160,Bloomington bookkeeper &amp; QuickBooks accountant.,yes
/find-an-accountant/illinois/cities/champaign/,find-an-accountant,location-child,t-location-child,BOFU,Service,yes,11,none,yes,Champaign Bookkeeper &amp; QuickBooks Accountant · TechBrot,59,154,Champaign bookkeeper &amp; QuickBooks accountant.,yes
/find-an-accountant/illinois/cities/chicago/,find-an-accountant,location-child,t-location-child,BOFU,Service,yes,8,none,yes,Chicago Bookkeeper &amp; QuickBooks Accountant · TechBrot,57,159,Chicago bookkeeper &amp; QuickBooks accountant.,yes
/find-an-accountant/illinois/cities/decatur/,find-an-accountant,location-child,t-location-child,BOFU,Service,yes,10,none,yes,Decatur Bookkeeper &amp; QuickBooks Accountant · TechBrot,57,152,Decatur bookkeeper &amp; QuickBooks accountant.,yes
/find-an-accountant/illinois/cities/joliet/,find-an-accountant,location-child,t-location-child,BOFU,Service,yes,8,none,yes,Joliet Bookkeeper &amp; QuickBooks Accountant · TechBrot,56,159,Joliet bookkeeper &amp; QuickBooks accountant.,yes
/find-an-accountant/illinois/cities/naperville/,find-an-accountant,location-child,t-location-child,BOFU,Service,yes,8,none,yes,Naperville Bookkeeper &amp; QuickBooks Accountant · TechBrot,60,154,Naperville bookkeeper &amp; QuickBooks accountant.,yes
/find-an-accountant/illinois/cities/peoria/,find-an-accountant,location-child,t-location-child,BOFU,Service,yes,10,none,yes,Peoria Bookkeeper &amp; QuickBooks Accountant · TechBrot,56,157,Peoria bookkeeper &amp; QuickBooks accountant.,yes
/find-an-accountant/illinois/cities/rockford/,find-an-accountant,location-child,t-location-child,BOFU,Service,yes,8,none,yes,Rockford Bookkeeper &amp; QuickBooks Accountant · TechBrot,58,158,Rockford bookkeeper &amp; QuickBooks accountant.,yes
/find-an-accountant/illinois/cities/schaumburg/,find-an-accountant,location-child,t-location-child,BOFU,Service,yes,10,none,yes,Schaumburg Bookkeeper &amp; QuickBooks Accountant · TechBrot,60,155,Schaumburg bookkeeper &amp; QuickBooks accountant.,yes
/find-an-accountant/illinois/cities/springfield/,find-an-accountant,location-child,t-location-child,BOFU,Service,yes,10,none,yes,Springfield Bookkeeper &amp; QuickBooks Accountant · TechBrot,61,153,Springfield bookkeeper &amp; QuickBooks accountant.,yes
/find-an-accountant/illinois/cleanup-bookkeeping/,find-an-accountant,location-child,t-location-child,BOFU,Service,yes,6,none,yes,Illinois Cleanup &amp; Catch-Up Bookkeeping · TechBrot,54,151,Months &mdash; or years &mdash; behind on the books? We&rsquo;ll catch you up.,yes
/find-an-accountant/illinois/industries/,find-an-accountant,location-child,t-location,BOFU,CollectionPage,yes,6,none,yes,Illinois Industry-Specific Accounting · TechBrot,48,160,"Illinois accounting, built for your industry.",yes
/find-an-accountant/illinois/industries/agency/,find-an-accountant,location-child,t-location-child,BOFU,Service,yes,7,none,yes,Illinois Agency &amp; Creative Accounting · TechBrot,52,163,Illinois agency accounting that tells you which projects and retainers actually pay.,yes
/find-an-accountant/illinois/industries/healthcare/,find-an-accountant,location-child,t-location-child,BOFU,Service,yes,7,none,yes,Illinois Healthcare &amp; Medical Practice Accounting · TechBrot,64,163,Illinois medical-practice accounting that reconciles what you&rsquo;re actually paid.,yes
/find-an-accountant/illinois/industries/manufacturing/,find-an-accountant,location-child,t-location-child,BOFU,Service,yes,7,none,yes,Illinois Manufacturing Accounting · TechBrot,44,159,"Illinois manufacturing accounting that tracks the exemption, the inventory, and the tax.",yes
/find-an-accountant/illinois/industries/professional-services/,find-an-accountant,location-child,t-location-child,BOFU,Service,yes,7,none,yes,Illinois Law Firm &amp; Professional Services Accounting,56,164,Illinois professional-services accounting that shows which work pays.,yes
/find-an-accountant/illinois/industries/restaurant/,find-an-accountant,location-child,t-location-child,BOFU,Service,yes,7,none,yes,Illinois Restaurant Accounting · TechBrot,41,162,Illinois restaurant accounting that reconciles every tender to the bank.,yes
/find-an-accountant/illinois/industries/trucking/,find-an-accountant,location-child,t-location-child,BOFU,Service,yes,7,none,yes,Illinois Trucking &amp; Logistics Accounting · TechBrot,55,161,Illinois trucking accounting that keeps the IFTA records and the per-mile numbers straight.,yes
/find-an-accountant/illinois/monthly-bookkeeping/,find-an-accountant,location-child,t-location-child,BOFU,Service,yes,6,none,yes,Illinois Monthly Bookkeeping · TechBrot,39,152,Monthly bookkeeping that closes the books every month.,yes
/find-an-accountant/illinois/pricing/,find-an-accountant,location-child,t-prose,BOFU,Service,yes,6,badge,yes,Illinois Bookkeeping &amp; QuickBooks Pricing · TechBrot,56,153,Fixed-fee Illinois pricing — written scope before any work.,yes
/find-an-accountant/illinois/quickbooks-accountant/,find-an-accountant,location-child,t-location-child,BOFU,Service,yes,8,none,yes,Illinois QuickBooks Accountant &amp; ProAdvisor · TechBrot,58,158,"Your Illinois QuickBooks accountant &mdash; ProAdvisor expertise, Illinois rules.",yes
/find-an-accountant/illinois/quickbooks-cleanup/,find-an-accountant,location-child,t-location-child,BOFU,Service,yes,8,none,yes,Illinois QuickBooks Cleanup · TechBrot,38,151,"Illinois QuickBooks cleanup, back to CPA-ready.",yes
/find-an-accountant/illinois/quickbooks-error-fixes/,find-an-accountant,location-child,t-location-child,BOFU,Service,yes,8,none,yes,Illinois QuickBooks Error Fixes · TechBrot,42,163,"Illinois QuickBooks errors, traced to the root and fixed.",yes
/find-an-accountant/illinois/quickbooks-migration/,find-an-accountant,location-child,t-location-child,BOFU,Service,yes,7,none,yes,Illinois QuickBooks Migration · TechBrot,40,155,Illinois QuickBooks migration without losing your history.,yes
/find-an-accountant/illinois/quickbooks-reconciliation/,find-an-accountant,location-child,t-location-child,BOFU,Service,yes,7,none,yes,Illinois QuickBooks Reconciliation · TechBrot,45,151,Illinois QuickBooks reconciliation that actually ties.,yes
/find-an-accountant/illinois/quickbooks-setup/,find-an-accountant,location-child,t-location-child,BOFU,Service,yes,9,none,yes,Illinois QuickBooks Setup · TechBrot,36,158,"Illinois QuickBooks setup, done right the first time.",yes
/find-an-accountant/illinois/quickbooks-training/,find-an-accountant,location-child,t-location-child,BOFU,Service,yes,7,none,yes,Illinois QuickBooks Training · TechBrot,39,158,"QuickBooks training for your Illinois team, done your way.",yes
/find-an-accountant/illinois/replacement-tax-help/,find-an-accountant,location-child,t-location-child,BOFU,Service,yes,6,none,yes,Illinois Replacement Tax (PPRT) &amp; PTE Help · TechBrot,57,157,"Illinois&rsquo;s entity-level taxes, tracked in your books all year.",yes
/find-an-accountant/illinois/sales-tax-help/,find-an-accountant,location-child,t-location-child,BOFU,Service,yes,6,none,yes,Illinois Sales Tax &amp; Chicago Cloud Tax · TechBrot,53,163,Illinois sales tax &mdash; and Chicago&rsquo;s cloud tax &mdash; set up right and reconciled.,yes
/find-an-accountant/illinois/small-business-accountant/,find-an-accountant,location-child,t-location-child,BOFU,Service,yes,6,none,yes,Illinois Small Business Accountant · TechBrot,45,163,A small business accountant who actually knows Illinois.,yes
/find-an-accountant/illinois/speak-to-a-proadvisor/,find-an-accountant,location-child,t-triage,BOFU,Service,yes,7,none,yes,Speak to an Illinois QuickBooks ProAdvisor · TechBrot,53,150,"Speak to an Illinois QuickBooks ProAdvisor &mdash; free, no sales pitch.",yes
/find-an-accountant/illinois/state-tax-notice-help/,find-an-accountant,location-child,t-location-child,BOFU,Service,yes,8,none,yes,"Illinois Tax Notice Help · IDOR, Chicago, IRS · TechBrot",56,156,"Got an Illinois tax notice? Read it right, then act.",yes
/find-an-accountant/illinois/urgent-bookkeeping/,find-an-accountant,location-child,t-location-child,BOFU,Service,yes,6,none,yes,Illinois Urgent &amp; Fast-Turnaround Bookkeeping · TechBrot,60,156,An Illinois deadline looming and the books not ready? Call us.,yes
/find-an-accountant/illinois/virtual-bookkeeper/,find-an-accountant,location-child,t-location-child,BOFU,Service,yes,6,none,yes,Illinois Virtual Bookkeeper · TechBrot,38,157,"A virtual bookkeeper for Illinois &mdash; same expert, every month, anywhere in the state.",yes
/find-an-accountant/indiana/,find-an-accountant,state-pillar,t-state-pillar,BOFU,Service,yes,10,badge,yes,Indiana QuickBooks ProAdvisors &amp; Bookkeeping · TechBrot,59,153,QuickBooks ProAdvisors &amp; Bookkeeping for Indiana Businesses.,yes
/find-an-accountant/indiana/bookkeeping-services/,find-an-accountant,location-child,t-money,BOFU,Service,yes,7,badge,yes,Indiana Bookkeeping Services · TechBrot,39,153,"Indiana bookkeeping services &mdash; clean books, same bookkeeper, every month.",yes
/find-an-accountant/indiana/business-tax-problems/,find-an-accountant,location-child,t-triage,BOFU,Service,yes,8,none,yes,Indiana Business Tax Problems · TechBrot,40,156,Indiana business tax problems start in the books &mdash; so does the way out.,yes
/find-an-accountant/indiana/cities/,find-an-accountant,location-child,t-location,BOFU,CollectionPage,yes,6,none,yes,Indiana Bookkeeping — Cities We Serve · TechBrot,48,149,An Indiana bookkeeper for your city &mdash; every county&rsquo;s tax handled.,yes
/find-an-accountant/indiana/cities/bloomington/,find-an-accountant,location-child,t-location,BOFU,Service,yes,5,none,yes,Bloomington QuickBooks Accountant · TechBrot,44,148,Bloomington bookkeeper &amp; QuickBooks accountant.,yes
/find-an-accountant/indiana/cities/carmel/,find-an-accountant,location-child,t-location,BOFU,Service,yes,5,none,yes,Carmel QuickBooks Accountant · TechBrot,39,158,Carmel bookkeeper &amp; QuickBooks accountant.,yes
/find-an-accountant/indiana/cities/evansville/,find-an-accountant,location-child,t-location,BOFU,Service,yes,5,none,yes,Evansville QuickBooks Accountant · TechBrot,43,161,Evansville bookkeeper &amp; QuickBooks accountant.,yes
/find-an-accountant/indiana/cities/fishers/,find-an-accountant,location-child,t-location,BOFU,Service,yes,5,none,yes,Fishers QuickBooks Accountant · TechBrot,40,157,Fishers bookkeeper &amp; QuickBooks accountant.,yes
/find-an-accountant/indiana/cities/fort-wayne/,find-an-accountant,location-child,t-location,BOFU,Service,yes,5,none,yes,Fort Wayne QuickBooks Accountant · TechBrot,43,162,Fort Wayne bookkeeper &amp; QuickBooks accountant.,yes
/find-an-accountant/indiana/cities/hammond/,find-an-accountant,location-child,t-location,BOFU,Service,yes,5,none,yes,Hammond QuickBooks Accountant · TechBrot,40,145,Hammond bookkeeper &amp; QuickBooks accountant.,yes
/find-an-accountant/indiana/cities/indianapolis/,find-an-accountant,location-child,t-location,BOFU,Service,yes,5,none,yes,Indianapolis QuickBooks Accountant · TechBrot,45,153,Indianapolis bookkeeper &amp; QuickBooks accountant.,yes
/find-an-accountant/indiana/cities/south-bend/,find-an-accountant,location-child,t-location,BOFU,Service,yes,5,none,yes,South Bend QuickBooks Accountant · TechBrot,43,156,South Bend bookkeeper &amp; QuickBooks accountant.,yes
/find-an-accountant/indiana/cleanup-bookkeeping/,find-an-accountant,location-child,t-money,BOFU,Service,yes,7,badge,yes,Indiana Bookkeeping Cleanup · Fix Messy Books · TechBrot,56,142,"Indiana bookkeeping cleanup &mdash; messy books are common, and fixable.",yes
/find-an-accountant/indiana/county-income-tax-help/,find-an-accountant,location-child,t-money,BOFU,Service,yes,7,none,yes,Indiana County Income Tax Help · TechBrot,41,141,"Indiana county income tax, withheld right in your payroll.",yes
/find-an-accountant/indiana/industries/,find-an-accountant,location-child,t-location,BOFU,CollectionPage,yes,6,none,yes,Indiana Industry Accounting &amp; Bookkeeping · TechBrot,56,143,Indiana industry accounting &mdash; built around how your business runs.,yes
/find-an-accountant/indiana/industries/agriculture/,find-an-accountant,location-child,t-money,BOFU,Service,yes,6,badge,yes,Indiana Farm &amp; Agriculture Accounting · TechBrot,52,137,Indiana farm accounting that shows which enterprise actually pays.,yes
/find-an-accountant/indiana/industries/construction/,find-an-accountant,location-child,t-money,BOFU,Service,yes,6,badge,yes,Indiana Construction Accounting &amp; Job Costing · TechBrot,60,119,Indiana construction accounting that knows which job made money.,yes
/find-an-accountant/indiana/industries/healthcare/,find-an-accountant,location-child,t-money,BOFU,Service,yes,6,badge,yes,Indiana Healthcare Practice Accounting · TechBrot,49,137,Indiana healthcare accounting that shows what you actually collect.,yes
/find-an-accountant/indiana/industries/logistics-distribution/,find-an-accountant,location-child,t-money,BOFU,Service,yes,6,badge,yes,Indiana Logistics &amp; Distribution Accounting · TechBrot,58,149,Indiana logistics accounting that knows which lane makes money.,yes
/find-an-accountant/indiana/industries/manufacturing/,find-an-accountant,location-child,t-money,BOFU,Service,yes,6,badge,yes,Indiana Manufacturing Accounting &amp; Job Costing · TechBrot,61,148,Indiana manufacturing accounting that knows which product makes money.,yes
/find-an-accountant/indiana/industries/real-estate/,find-an-accountant,location-child,t-money,BOFU,Service,yes,6,badge,yes,Indiana Real Estate Accounting &amp; Bookkeeping · TechBrot,59,141,Indiana real estate accounting that shows which property pays.,yes
/find-an-accountant/indiana/monthly-bookkeeping/,find-an-accountant,location-child,t-money,BOFU,Service,yes,7,badge,yes,Indiana Monthly Bookkeeping · Close by the 15th · TechBrot,58,142,"Indiana monthly bookkeeping &mdash; books closed every month, on time.",yes
/find-an-accountant/indiana/pricing/,find-an-accountant,location-child,t-prose,BOFU,Service,yes,7,badge,yes,Indiana Bookkeeping &amp; QuickBooks Pricing · TechBrot,55,150,Fixed-fee Indiana pricing &mdash; written scope before any work.,yes
/find-an-accountant/indiana/quickbooks-accountant/,find-an-accountant,location-child,t-money,BOFU,Service,yes,7,badge,yes,Indiana QuickBooks Accountant &amp; ProAdvisor · TechBrot,57,142,"Your Indiana QuickBooks accountant &mdash; ProAdvisor expertise, Indiana rules.",yes
/find-an-accountant/indiana/quickbooks-cleanup/,find-an-accountant,location-child,t-money,BOFU,Service,yes,7,badge,yes,Indiana QuickBooks Cleanup &amp; File Repair · TechBrot,55,158,When QuickBooks itself is the problem.,yes
/find-an-accountant/indiana/quickbooks-error-fixes/,find-an-accountant,location-child,t-location-child,BOFU,Service,yes,7,none,yes,Indiana QuickBooks Error Fixes · TechBrot,41,154,Indiana QuickBooks error fixes &mdash; the code and the cause.,yes
/find-an-accountant/indiana/quickbooks-migration/,find-an-accountant,location-child,t-money,BOFU,Service,yes,7,badge,yes,Indiana QuickBooks Migration · Desktop to Online · TechBrot,59,147,QuickBooks Desktop is ending. Migrate professionally.,yes
/find-an-accountant/indiana/quickbooks-reconciliation/,find-an-accountant,location-child,t-money,BOFU,Service,yes,7,none,yes,Indiana QuickBooks Reconciliation · TechBrot,44,148,Indiana QuickBooks reconciliation that ties every account to reality.,yes
/find-an-accountant/indiana/quickbooks-setup/,find-an-accountant,location-child,t-money,BOFU,Service,yes,7,none,yes,Indiana QuickBooks Setup · TechBrot,35,156,Indiana QuickBooks setup done right from day one.,yes
/find-an-accountant/indiana/quickbooks-training/,find-an-accountant,location-child,t-money,BOFU,Service,yes,7,none,yes,Indiana QuickBooks Training · TechBrot,38,142,Learn QuickBooks the way your business actually uses it.,yes
/find-an-accountant/indiana/sales-tax-help/,find-an-accountant,location-child,t-money,BOFU,Service,yes,7,none,yes,Indiana Sales Tax Help for Businesses · TechBrot,48,137,"Indiana sales tax, tracked right in your books.",yes
/find-an-accountant/indiana/small-business-accountant/,find-an-accountant,location-child,t-money,BOFU,Service,yes,7,none,yes,Indiana Small Business Accountant · TechBrot,44,145,"Your Indiana small business accountant, starting with the books.",yes
/find-an-accountant/indiana/speak-to-a-proadvisor/,find-an-accountant,location-child,t-triage,BOFU,Service,yes,8,none,yes,Speak to an Indiana QuickBooks ProAdvisor · TechBrot,52,149,"Speak to an Indiana QuickBooks ProAdvisor &mdash; free, no sales pitch.",yes
/find-an-accountant/indiana/state-tax-notice-help/,find-an-accountant,location-child,t-triage,BOFU,Service,yes,8,none,yes,Indiana State Tax Notice Help · TechBrot,40,140,"Got an Indiana tax notice? Read it right, then act.",yes
/find-an-accountant/indiana/urgent-bookkeeping/,find-an-accountant,location-child,t-triage,BOFU,Service,yes,7,none,yes,Indiana Urgent Bookkeeping · TechBrot,37,148,Behind on your books with a deadline bearing down?,yes
/find-an-accountant/indiana/virtual-bookkeeper/,find-an-accountant,location-child,t-money,BOFU,Service,yes,7,none,yes,Indiana Virtual Bookkeeper · TechBrot,37,143,"An Indiana virtual bookkeeper &mdash; in-house expertise, none of the overhead.",yes
/find-an-accountant/maryland/,find-an-accountant,state-pillar,t-state-pillar,BOFU,Service,yes,9,badge,yes,Maryland QuickBooks ProAdvisors &amp; Bookkeeping,49,159,QuickBooks ProAdvisors &amp; Bookkeeping for Maryland Businesses.,yes
/find-an-accountant/maryland/bookkeeping-services/,find-an-accountant,location-child,t-money,BOFU,Service,yes,7,badge,yes,Maryland Bookkeeping Services · TechBrot,40,149,"Maryland bookkeeping services &mdash; clean books, same bookkeeper, every month.",yes
/find-an-accountant/maryland/quickbooks-accountant/,find-an-accountant,location-child,t-money,BOFU,Service,yes,7,badge,yes,Maryland QuickBooks Accountant &amp; ProAdvisor · TechBrot,58,156,"Your Maryland QuickBooks accountant &mdash; ProAdvisor expertise, Maryland rules.",yes
/find-an-accountant/maryland/quickbooks-cleanup/,find-an-accountant,location-child,t-money,BOFU,Service,yes,7,badge,yes,Maryland QuickBooks Cleanup &amp; Catch-Up · TechBrot,53,155,When QuickBooks itself is the problem.,yes
/find-an-accountant/maryland/quickbooks-setup/,find-an-accountant,location-child,t-money,BOFU,Service,yes,7,badge,yes,Maryland QuickBooks Setup &amp; Implementation,46,156,Maryland QuickBooks setup done right from day one.,yes
/find-an-accountant/maryland/small-business-accountant/,find-an-accountant,location-child,t-money,BOFU,Service,yes,7,badge,yes,Maryland Small Business Accountant · TechBrot,45,155,"Your Maryland small business accountant, starting with the books.",yes
/find-an-accountant/massachusetts/,find-an-accountant,state-pillar,t-state-pillar,BOFU,Service,yes,9,badge,yes,Massachusetts QuickBooks ProAdvisors &amp; Bookkeeping,54,161,QuickBooks ProAdvisors &amp; Bookkeeping for Massachusetts Businesses.,yes
/find-an-accountant/massachusetts/bookkeeping-services/,find-an-accountant,location-child,t-money,BOFU,Service,yes,7,badge,yes,Massachusetts Bookkeeping Services · TechBrot,45,155,"Massachusetts bookkeeping services &mdash; clean books, same bookkeeper, every month.",yes
/find-an-accountant/massachusetts/quickbooks-accountant/,find-an-accountant,location-child,t-money,BOFU,Service,yes,7,badge,yes,Massachusetts QuickBooks Accountant · TechBrot,46,155,"Your Massachusetts QuickBooks accountant &mdash; ProAdvisor expertise, Massachusetts rules.",yes
/find-an-accountant/massachusetts/quickbooks-cleanup/,find-an-accountant,location-child,t-money,BOFU,Service,yes,7,badge,yes,Massachusetts QuickBooks Cleanup · TechBrot,43,151,When QuickBooks itself is the problem.,yes
/find-an-accountant/massachusetts/quickbooks-setup/,find-an-accountant,location-child,t-money,BOFU,Service,yes,7,badge,yes,Massachusetts QuickBooks Setup &amp; Implementation,51,155,Massachusetts QuickBooks setup done right from day one.,yes
/find-an-accountant/massachusetts/small-business-accountant/,find-an-accountant,location-child,t-money,BOFU,Service,yes,7,badge,yes,Massachusetts Small Business Accountant · TechBrot,50,152,"Your Massachusetts small business accountant, starting with the books.",yes
/find-an-accountant/michigan/,find-an-accountant,state-pillar,t-state-pillar,BOFU,Service,yes,9,badge,yes,Michigan QuickBooks ProAdvisors &amp; Bookkeeping,49,173,QuickBooks ProAdvisors &amp; Bookkeeping for Michigan Businesses.,yes
/find-an-accountant/michigan/bookkeeping-services/,find-an-accountant,location-child,t-money,BOFU,Service,yes,7,badge,yes,Michigan Bookkeeping Services · TechBrot,40,156,"Michigan bookkeeping services &mdash; clean books, same bookkeeper, every month.",yes
/find-an-accountant/michigan/quickbooks-accountant/,find-an-accountant,location-child,t-money,BOFU,Service,yes,7,badge,yes,Michigan QuickBooks Accountant &amp; ProAdvisor · TechBrot,58,151,"Your Michigan QuickBooks accountant &mdash; ProAdvisor expertise, Michigan rules.",yes
/find-an-accountant/michigan/quickbooks-cleanup/,find-an-accountant,location-child,t-money,BOFU,Service,yes,7,badge,yes,Michigan QuickBooks Cleanup &amp; Catch-Up · TechBrot,53,151,When QuickBooks itself is the problem.,yes
/find-an-accountant/michigan/quickbooks-setup/,find-an-accountant,location-child,t-money,BOFU,Service,yes,7,badge,yes,Michigan QuickBooks Setup &amp; Implementation,46,155,Michigan QuickBooks setup done right from day one.,yes
/find-an-accountant/michigan/small-business-accountant/,find-an-accountant,location-child,t-money,BOFU,Service,yes,7,badge,yes,Michigan Small Business Accountant · TechBrot,45,144,"Your Michigan small business accountant, starting with the books.",yes
/find-an-accountant/new-jersey/,find-an-accountant,state-pillar,t-state-pillar,BOFU,Service,yes,9,badge,yes,New Jersey QuickBooks ProAdvisors &amp; Bookkeeping,51,151,QuickBooks ProAdvisors &amp; Bookkeeping for New Jersey Businesses.,yes
/find-an-accountant/new-jersey/bookkeeping-services/,find-an-accountant,location-child,t-money,BOFU,Service,yes,7,badge,yes,New Jersey Bookkeeping Services · TechBrot,42,153,"New Jersey bookkeeping services &mdash; clean books, same bookkeeper, every month.",yes
/find-an-accountant/new-jersey/quickbooks-accountant/,find-an-accountant,location-child,t-money,BOFU,Service,yes,7,badge,yes,New Jersey QuickBooks Accountant &amp; ProAdvisor · TechBrot,60,148,"Your New Jersey QuickBooks accountant &mdash; ProAdvisor expertise, New Jersey rules.",yes
/find-an-accountant/new-jersey/quickbooks-cleanup/,find-an-accountant,location-child,t-money,BOFU,Service,yes,7,badge,yes,New Jersey QuickBooks Cleanup &amp; Catch-Up · TechBrot,55,150,When QuickBooks itself is the problem.,yes
/find-an-accountant/new-jersey/quickbooks-setup/,find-an-accountant,location-child,t-money,BOFU,Service,yes,7,badge,yes,New Jersey QuickBooks Setup &amp; Implementation,48,148,New Jersey QuickBooks setup done right from day one.,yes
/find-an-accountant/new-jersey/small-business-accountant/,find-an-accountant,location-child,t-money,BOFU,Service,yes,7,badge,yes,New Jersey Small Business Accountant · TechBrot,47,150,"Your New Jersey small business accountant, starting with the books.",yes
/find-an-accountant/new-york/,find-an-accountant,state-pillar,t-state-pillar,BOFU,Service,yes,12,badge,yes,New York QuickBooks ProAdvisors &amp; Bookkeeping · TechBrot,60,159,QuickBooks ProAdvisors &amp; Bookkeeping for New York Businesses.,yes
/find-an-accountant/new-york/bookkeeping-services/,find-an-accountant,location-child,t-money,BOFU,Service,yes,8,badge,yes,New York Bookkeeping Services · TechBrot,40,146,"New York bookkeeping services &mdash; clean books, same bookkeeper, every month.",yes
/find-an-accountant/new-york/business-tax-problems/,find-an-accountant,location-child,t-triage,BOFU,Service,yes,8,none,yes,New York Business Tax Problems · TechBrot,41,149,New York business tax problems start in the books &mdash; so does the way out.,yes
/find-an-accountant/new-york/cities/,find-an-accountant,location-child,t-location,BOFU,FAQPage,yes,6,none,yes,New York Bookkeeping — Cities We Serve · TechBrot,49,160,A New York bookkeeper for your city &mdash; all 62 counties.,yes
