url,silo,page_type,template,funnel_stage,schema_type,has_faq,faq_count,trust_strip,reviewed_by_david,title,title_len,meta_desc_len,h1,in_sitemap
/,root,home,t-hub,MOFU,FAQPage,yes,7,none,no,QuickBooks ProAdvisor Bookkeeping &amp; Accounting · TechBrot,61,154,Automation handles the data entry. We handle the judgment.,yes
/about/,about,hub,t-hub,MOFU,AboutPage,yes,6,none,yes,About · Independent QuickBooks ProAdvisor Firm · TechBrot,57,155,An accounting platform built on a decade of practice.,yes
/about/methodology/,about,prose,t-prose,MOFU,HowTo,yes,6,none,no,Our Methodology · 5-Phase Engagement · TechBrot,47,147,The same operating model behind every engagement.,yes
/about/network/,about,prose,t-prose,MOFU,FAQPage,yes,6,none,no,ProAdvisor Network · How the Model Works · TechBrot,51,151,"A platform, not a single firm.",yes
/accounting-systems/,accounting-systems,hub,t-hub,MOFU,CollectionPage,yes,6,badge,no,Accounting Systems Advisory · TechBrot,38,140,"Before you pick software, get the system right.",yes
/accounting-systems/migration-planning/,accounting-systems,prose,t-prose,MOFU,Service,yes,8,none,no,Accounting Systems Migration Planning · TechBrot,48,148,Accounting systems migration planning.,yes
/accounting/,accounting,hub,t-hub,MOFU,Service,yes,10,badge,no,Accounting &amp; Bookkeeping for Small Businesses · TechBrot,60,150,"Operational accounting, built on QuickBooks expertise.",yes
/accounting/1099-preparation/,accounting,prose,t-prose,MOFU,Service,yes,8,badge,yes,1099 Preparation &amp; Filing Services · TechBrot,49,150,1099 preparation &amp; filing services.,yes
/accounting/accounts-payable/,accounting,prose,t-prose,MOFU,Service,yes,8,badge,yes,Accounts Payable Management Services · TechBrot,47,147,"Accounts payable management, kept clean in your QuickBooks.",yes
/accounting/accounts-receivable/,accounting,prose,t-prose,MOFU,Service,yes,8,badge,yes,Accounts Receivable Management Services · TechBrot,50,150,Accounts receivable management.,yes
/accounting/advisory/,accounting,hub,t-hub,MOFU,Service,yes,9,badge,no,Accounting Advisory &amp; Fractional CFO Services · TechBrot,60,153,Automation handles the data entry. We handle the judgment.,yes
/accounting/advisory/budgeting-forecasting/,accounting,prose,t-prose,MOFU,Service,yes,6,badge,no,Budgeting &amp; Forecasting Services · TechBrot,47,151,A budget isn&rsquo;t a wish list. It&rsquo;s a contract with the year.,yes
/accounting/advisory/business-performance-review/,accounting,prose,t-prose,MOFU,Service,yes,6,badge,no,Business Performance Review Services · TechBrot,47,154,Reports get read. Reviews get acted on.,yes
/accounting/advisory/cash-flow-management/,accounting,prose,t-prose,MOFU,Service,yes,6,badge,yes,Cash Flow Management &amp; Forecasting Services · TechBrot,58,151,Stop guessing what your bank balance will be.,yes
/accounting/advisory/faq/,accounting,faq-hub,t-prose,TOFU,CollectionPage,yes,7,none,yes,Advisory &amp; Fractional CFO FAQ · TechBrot,44,155,"Advisory &amp; fractional CFO, answered.",yes
/accounting/advisory/financial-strategy/,accounting,prose,t-prose,MOFU,Service,yes,6,badge,no,Financial Strategy Advisory Services · TechBrot,47,159,The numbers say what&rsquo;s happening. Strategy decides what to do.,yes
/accounting/advisory/fractional-cfo/,accounting,money/service,t-money,BOFU,Service,yes,8,badge,yes,Fractional CFO Services for $1M–$50M Businesses · TechBrot,58,153,Strategic financial leadership. Without the $300K hire.,yes
/accounting/advisory/kpi-reporting/,accounting,prose,t-prose,MOFU,Service,yes,6,badge,no,KPI &amp; Management Reporting Services · TechBrot,50,156,A P&amp;L tells you what happened. KPIs tell you what to do.,yes
/accounting/advisory/tax-planning/,accounting,prose,t-prose,MOFU,Service,yes,8,badge,yes,Tax Planning Support: Books Your CPA Can Plan From,50,158,Books your CPA can actually plan from.,yes
/accounting/bookkeeping/,accounting,hub,t-hub,MOFU,Service,yes,11,badge,yes,Bookkeeping Services for U.S. Small Businesses · TechBrot,57,157,Bookkeeping services built for U.S. small businesses.,yes
/accounting/bookkeeping/catch-up-bookkeeping/,accounting,money/service,t-money,BOFU,Service,yes,7,badge,yes,Catch-Up Bookkeeping Services · TechBrot,40,145,Months behind. Maybe years. We can fix that.,yes
/accounting/bookkeeping/cleanup-bookkeeping/,accounting,money/service,t-money,BOFU,Service,yes,7,badge,yes,QuickBooks &amp; Bookkeeping Cleanup Services · TechBrot,56,144,Messy books are common. They&rsquo;re also fixable.,yes
/accounting/bookkeeping/faq/,accounting,faq-hub,t-prose,TOFU,CollectionPage,yes,18,none,yes,"Bookkeeping FAQ: Monthly, Cleanup, Catch-Up · TechBrot",54,157,"Bookkeeping, answered.",yes
/accounting/bookkeeping/monthly-bookkeeping/,accounting,money/service,t-money,BOFU,Service,yes,7,badge,yes,Monthly Bookkeeping Services · TechBrot,39,144,Books closed every month. By a real operator. On time.,yes
/accounting/chart-of-accounts-setup/,accounting,prose,t-prose,MOFU,Service,yes,6,badge,yes,Chart of Accounts Setup for QuickBooks · TechBrot,49,157,The structure decides what your books can ever tell you.,yes
/accounting/faq/,accounting,faq-hub,t-prose,TOFU,CollectionPage,yes,18,none,yes,"Accounting FAQ: Bookkeeping, Advisory, Payroll · TechBrot",57,159,"Accounting, answered.",yes
/accounting/financial-statements/,accounting,prose,t-prose,MOFU,Service,yes,6,badge,yes,"Financial Statements: P&amp;L, Balance Sheet, Cash Flow",55,146,Three statements. One real picture of the business.,yes
/accounting/industries/,accounting,hub,t-hub,MOFU,Service,yes,9,badge,no,Industry-Specific Accounting &amp; Bookkeeping · TechBrot,57,143,Accounting built around how your industry actually runs.,yes
/accounting/industries/agency/,accounting,prose,t-prose,MOFU,Service,yes,7,none,yes,Agency Accounting: Gross-vs-Net &amp; Real AGI · TechBrot,57,151,Agency accounting that gets gross-vs-net right and shows what you actually earn.,yes
/accounting/industries/amazon-sellers/,accounting,prose,t-prose,MOFU,Service,yes,6,none,yes,Amazon Seller Accounting &amp; FBA Bookkeeping · TechBrot,57,158,Amazon seller accounting that ties the deposit back to the truth.,yes
/accounting/industries/auto-repair/,accounting,prose,t-prose,MOFU,Service,yes,7,none,yes,"Auto Repair Shop Accounting: Parts, Labor &amp; Tech Hours",58,151,Auto repair accounting that separates parts from labor and shows every technician&rsquo;s productivity.,yes
/accounting/industries/construction/,accounting,prose,t-prose,MOFU,Service,yes,6,none,yes,Construction Accounting &amp; QuickBooks Job Costing · TechBrot,63,148,Construction accounting that knows which job made money.,yes
/accounting/industries/dental/,accounting,prose,t-prose,MOFU,Service,yes,7,none,yes,Dental Practice Accounting: Production vs Collection,52,155,"Dental practice accounting that shows production, collection, and every adjustment in between.",yes
/accounting/industries/ecommerce/,accounting,prose,t-prose,MOFU,Service,yes,6,none,yes,"E-commerce Accounting: Shopify, Amazon &amp; Stripe · TechBrot",62,160,E-commerce accounting that survives multi-channel reality.,yes
/accounting/industries/faq/,accounting,faq-hub,t-prose,TOFU,CollectionPage,yes,7,none,yes,Industry Accounting FAQ · Why Specialization Matters,52,159,"Industry-specific accounting, answered.",yes
/accounting/industries/fitness/,accounting,prose,t-prose,MOFU,Service,yes,7,none,yes,Gym &amp; Fitness Studio Accounting: Membership Revenue,55,159,Fitness accounting that recognizes every membership correctly and shows LTV against CAC.,yes
/accounting/industries/franchise/,accounting,prose,t-prose,MOFU,Service,yes,7,none,yes,"Franchise Accounting: Royalties, Ad Fund &amp; Multi-Unit",57,156,Franchise accounting that survives the royalty audit and supports the next unit.,yes
/accounting/industries/healthcare/,accounting,prose,t-prose,MOFU,Service,yes,7,none,yes,Medical Practice &amp; Healthcare Accounting · TechBrot,55,152,"Healthcare accounting that tracks what you collect, not just what you bill.",yes
/accounting/industries/home-services/,accounting,prose,t-prose,MOFU,Service,yes,7,none,yes,Home Services Accounting: Revenue Per Truck &amp; Plans,55,160,Home services accounting that shows revenue per truck and the real cost of every call.,yes
/accounting/industries/landscaping/,accounting,prose,t-prose,MOFU,Service,yes,7,none,yes,"Landscaping Accounting: Contracts, Crews &amp; Seasons",54,158,"Landscaping accounting that handles three revenue streams, severe seasonality, and every crew.",yes
/accounting/industries/law-firm-trust-accounting/,accounting,prose,t-prose,MOFU,Service,yes,8,none,yes,Law Firm Trust (IOLTA) Accounting · Three-Way Reconciliation,60,148,"IOLTA and client-trust books, reconciled three ways every month.",yes
/accounting/industries/legal/,accounting,prose,t-prose,MOFU,Service,yes,7,none,yes,Law Firm Accounting &amp; IOLTA Trust Bookkeeping · TechBrot,60,158,Law firm accounting that keeps trust money exactly where it belongs.,yes
/accounting/industries/manufacturing/,accounting,prose,t-prose,MOFU,Service,yes,7,none,yes,"Manufacturing Accounting: Inventory, BOM &amp; Job Costing",58,153,Manufacturing accounting that tracks every raw material to every finished sale.,yes
/accounting/industries/nonprofit/,accounting,prose,t-prose,MOFU,Service,yes,7,none,yes,Nonprofit Accounting: Fund Accounting &amp; Form 990,52,158,"Nonprofit accounting that survives the audit, the board, and the Form 990.",yes
/accounting/industries/professional-services/,accounting,prose,t-prose,MOFU,Service,yes,7,none,yes,Professional Services Accounting: Utilization &amp; WIP,55,158,Professional services accounting that finally shows you the economics.,yes
/accounting/industries/property-management/,accounting,prose,t-prose,MOFU,Service,yes,7,none,yes,Property Management Accounting &amp; Trust Bookkeeping,54,160,Property management books that keep other people&rsquo;s money straight.,yes
/accounting/industries/real-estate/,accounting,prose,t-prose,MOFU,Service,yes,7,none,yes,Real Estate Accounting &amp; QuickBooks Bookkeeping · TechBrot,62,156,Real estate accounting that knows which property actually makes money.,yes
/accounting/industries/restaurant/,accounting,prose,t-prose,MOFU,Service,yes,7,none,yes,Restaurant Accounting &amp; Prime Cost Bookkeeping · TechBrot,61,151,Restaurant accounting that finally shows your real prime cost.,yes
/accounting/industries/retail/,accounting,prose,t-prose,MOFU,Service,yes,7,none,yes,Retail Accounting: POS Reconciliation &amp; Inventory · TechBrot,64,164,Retail accounting that reconciles every register to every dollar.,yes
/accounting/industries/saas/,accounting,prose,t-prose,MOFU,Service,yes,7,none,yes,"SaaS Accounting: ASC 606, MRR &amp; Deferred Revenue · TechBrot",63,157,"SaaS accounting that survives ASC 606, the board deck, and the diligence room.",yes
/accounting/industries/shopify-sellers/,accounting,prose,t-prose,MOFU,Service,yes,6,none,yes,Shopify Accounting &amp; Payout Reconciliation · TechBrot,57,159,"Shopify accounting that reconciles the payout, not the screen.",yes
/accounting/industries/short-term-rentals/,accounting,prose,t-prose,MOFU,Service,yes,8,none,yes,Short-Term Rental &amp; Airbnb Accounting · TechBrot,52,157,"Short-term rental books that reconcile to the payout, not the booking.",yes
/accounting/industries/specialty-trades/,accounting,prose,t-prose,MOFU,Service,yes,7,none,yes,"HVAC, Plumbing &amp; Electrical Contractor Accounting",53,157,"Accounting for HVAC, plumbing, and electrical contractors that costs the ticket, not the month.",yes
/accounting/industries/trucking/,accounting,prose,t-prose,MOFU,Service,yes,7,none,yes,"Trucking Accounting: IFTA, Per-Diem &amp; Cost Per Mile",55,155,"Trucking accounting that handles IFTA, per-diem, and the cost of every mile.",yes
/accounting/job-costing/,accounting,prose,t-prose,MOFU,Service,yes,6,badge,yes,Job Costing Services in QuickBooks · TechBrot,45,160,Company-wide profit is comforting. Job-level profit is the truth.,yes
/accounting/month-end-close/,accounting,prose,t-prose,MOFU,Service,yes,6,badge,yes,Month-End Close Process &amp; Services · TechBrot,49,155,Close the books the same way every month. Then they&rsquo;re finally usable.,yes
/accounting/new-business-setup/,accounting,prose,t-prose,MOFU,Service,yes,8,badge,yes,New Business Accounting Setup Services · TechBrot,49,155,"New business accounting setup, done for you.",yes
/accounting/online-bookkeeping/,accounting,prose,t-prose,MOFU,Service,yes,9,badge,yes,Online Bookkeeping: How Cloud Bookkeeping Works,47,155,Online bookkeeping: how cloud bookkeeping works.,yes
/accounting/outsourced-bookkeeping/,accounting,prose,t-prose,MOFU,Service,yes,8,badge,yes,Outsourced Bookkeeping: In-House vs Outsourced · TechBrot,57,155,Outsourced bookkeeping: in-house vs outsourced.,yes
/accounting/payroll-management/,accounting,money/service,t-money,BOFU,Service,yes,8,badge,yes,Payroll Management Services for Small Businesses · TechBrot,59,150,"Payroll, run right. Every cycle. Every state.",yes
/accounting/profitability-analysis/,accounting,prose,t-prose,MOFU,Service,yes,8,badge,yes,Profitability Analysis Services · TechBrot,42,159,Profitability analysis: see what actually makes and loses money.,yes
/accounting/reconciliation-services/,accounting,prose,t-prose,MOFU,Service,yes,6,badge,yes,Account Reconciliation Services for QuickBooks · TechBrot,57,159,Reconciliation is what makes books real.,yes
/accounting/sales-tax-compliance/,accounting,money/service,t-money,BOFU,Service,yes,8,badge,yes,Sales Tax Compliance Services · Multi-State · TechBrot,54,146,"Multi-state sales tax, handled before it&rsquo;s a problem.",yes
/accounting/services/,accounting,hub,t-hub,MOFU,Service,yes,8,badge,no,Accounting Services Catalog · TechBrot,38,148,"Accounting services, scoped properly. Priced honestly.",yes
/accounting/services/controller-services/,accounting,prose,t-prose,MOFU,Service,yes,6,badge,yes,Outsourced Controller Services · TechBrot,41,155,Someone has to own whether the books are right.,yes
/accounting/services/outsourced-accounting/,accounting,prose,t-prose,MOFU,Service,yes,6,badge,yes,Outsourced Accounting Services · TechBrot,41,158,Your whole accounting function. Run for you.,yes
/accounting/services/virtual-accounting/,accounting,prose,t-prose,MOFU,Service,yes,6,badge,yes,Virtual Accounting Services · TechBrot,38,160,"Your full accounting operation, run in the cloud.",yes
/accounting/small-business-accounting/,accounting,prose,t-prose,MOFU,Service,yes,8,badge,yes,Small Business Accounting Services · TechBrot,45,151,"Small business accounting, kept current in QuickBooks.",yes
/accounting/speak-to-an-accountant/,accounting,prose,t-triage,MOFU,Service,yes,8,none,yes,Speak to Our Certified ProAdvisor Team · TechBrot,49,151,Speak to our Certified ProAdvisor team.,yes
/accounting/startup-accounting/,accounting,prose,t-prose,MOFU,Service,yes,8,badge,yes,Startup Accounting Services · TechBrot,38,155,Startup accounting: clean books from the start.,yes
/accounting/tax/,accounting,hub,t-hub,MOFU,CollectionPage,yes,6,badge,yes,Tax-Ready Books &amp; CPA Coordination (Not Tax Prep) · TechBrot,64,156,Tax-ready books and a clean year-end package for your CPA.,yes
/accounting/tax/irs-problem-resolution/,accounting,prose,t-prose,MOFU,Service,yes,8,none,yes,IRS Problem Resolution: How a ProAdvisor Helps,46,149,IRS problem resolution: how a ProAdvisor helps (and who represents you).,yes
/accounting/year-end-review/,accounting,prose,t-prose,MOFU,Service,yes,8,badge,yes,Year-End Books Review &amp; CPA Handoff · TechBrot,50,153,Year-end books review &amp; CPA handoff.,yes
/app-stack/,app-stack,prose,t-prose,MOFU,Service,yes,8,none,no,Small-Business App Stack: The Tools You Need,44,152,Your small-business app stack: what tools you actually need.,yes
/blog/,blog,blog-hub,t-hub,TOFU,CollectionPage,no,0,none,no,TechBrot Blog · Bookkeeping &amp; QuickBooks Articles,53,156,"Bookkeeping, QuickBooks & business finance, explained straight.",yes
/blog/5-signs-your-books-need-a-cleanup/,blog,blog-post,t-article,TOFU,BlogPosting,yes,6,none,no,5 Signs Your Books Need a Cleanup · TechBrot,44,155,5 signs your books need a cleanup,yes
/blog/bookkeeping-vs-accounting/,blog,blog-post,t-article,TOFU,BlogPosting,yes,6,none,no,Bookkeeping vs Accounting: What&#39;s the Difference? · TechBrot,64,149,Bookkeeping vs accounting: what&rsquo;s the difference?,yes
/blog/category/accounting/,blog,blog-category,t-article,TOFU,CollectionPage,no,0,none,no,Accounting Articles · TechBrot Blog,35,132,Accounting,yes
/blog/category/ai-and-accounting/,blog,blog-category,t-article,TOFU,CollectionPage,no,0,none,no,AI &amp; Accounting Articles · TechBrot Blog,44,120,AI & Accounting,yes
/blog/category/bookkeeping/,blog,blog-category,t-article,TOFU,CollectionPage,no,0,none,no,Bookkeeping Articles · TechBrot Blog,36,107,Bookkeeping,yes
/blog/category/business-finance/,blog,blog-category,t-article,TOFU,CollectionPage,no,0,none,no,Business Finance Articles · TechBrot Blog,41,108,Business Finance,yes
/blog/category/partner-spotlight/,blog,blog-category,t-article,TOFU,CollectionPage,no,0,none,no,Partner Spotlight Articles · TechBrot Blog,42,117,Partner Spotlight,yes
/blog/category/payroll/,blog,blog-category,t-article,TOFU,CollectionPage,no,0,none,no,Payroll Articles · TechBrot Blog,32,128,Payroll,yes
/blog/category/quickbooks/,blog,blog-category,t-article,TOFU,CollectionPage,no,0,none,no,QuickBooks Articles · TechBrot Blog,35,130,QuickBooks,yes
/blog/category/taxes/,blog,blog-category,t-article,TOFU,CollectionPage,no,0,none,no,Taxes Articles · TechBrot Blog,30,132,Taxes,yes
/blog/get-your-books-ready-for-tax-season/,blog,blog-post,t-article,TOFU,BlogPosting,yes,6,none,no,Get Your Books Ready for Tax Season · A Checklist,49,164,How to get your books ready for tax season (without doing your taxes),yes
/blog/inside-the-techbrot-partner-program/,blog,blog-post,t-article,TOFU,BlogPosting,yes,6,none,no,Inside the TechBrot Accountant Partner Program · TechBrot,57,142,Inside the TechBrot accountant partner program,yes
/blog/profit-vs-cash-flow/,blog,blog-post,t-article,TOFU,BlogPosting,yes,6,none,no,Profit vs Cash Flow · Why Profitable Firms Go Broke,51,153,Profit vs cash flow: why a profitable business can still go broke,yes
/blog/quickbooks-online-vs-desktop-2026/,blog,blog-post,t-article,TOFU,BlogPosting,yes,6,none,no,QuickBooks Online vs Desktop in 2026 · Which to Use,51,162,QuickBooks Online vs Desktop in 2026: which should you use?,yes
/blog/w2-vs-1099-worker-classification/,blog,blog-post,t-article,TOFU,BlogPosting,yes,6,none,no,W-2 vs 1099 · How to Classify a Worker Correctly,48,149,W-2 vs 1099: how to classify a worker (and why it matters),yes
/blog/will-ai-replace-your-bookkeeper/,blog,blog-post,t-article,TOFU,BlogPosting,yes,6,none,no,Will AI Replace Your Bookkeeper? An Honest Answer · TechBrot,60,156,Will AI replace your bookkeeper? An honest answer,yes
/contact/,contact,contact,t-prose,BOFU,ContactPage,yes,5,none,no,Book a Free Discovery Call · TechBrot,37,149,Tell us about your books. We’ll do the rest.,yes
/find-an-accountant/,find-an-accountant,hub,t-hub,MOFU,CollectionPage,yes,9,badge,no,Find a Certified QuickBooks ProAdvisor · TechBrot,49,164,Find a Certified QuickBooks ProAdvisor for your business.,yes
/find-an-accountant/arizona/,find-an-accountant,state-pillar,t-state-pillar,BOFU,Service,yes,9,badge,yes,Arizona QuickBooks ProAdvisors &amp; Bookkeeping,48,152,QuickBooks ProAdvisors &amp; Bookkeeping for Arizona Businesses.,yes
/find-an-accountant/arizona/bookkeeping-services/,find-an-accountant,location-child,t-money,BOFU,Service,yes,7,badge,yes,Arizona Bookkeeping Services · TechBrot,39,150,"Arizona bookkeeping services &mdash; clean books, same bookkeeper, every month.",yes
/find-an-accountant/arizona/quickbooks-accountant/,find-an-accountant,location-child,t-money,BOFU,Service,yes,7,badge,yes,Arizona QuickBooks Accountant &amp; ProAdvisor · TechBrot,57,163,"Your Arizona QuickBooks accountant &mdash; ProAdvisor expertise, Arizona rules.",yes
/find-an-accountant/arizona/quickbooks-cleanup/,find-an-accountant,location-child,t-money,BOFU,Service,yes,7,badge,yes,Arizona QuickBooks Cleanup &amp; TPT Fixes · TechBrot,53,151,When QuickBooks itself is the problem.,yes
/find-an-accountant/arizona/quickbooks-setup/,find-an-accountant,location-child,t-money,BOFU,Service,yes,7,badge,yes,Arizona QuickBooks Setup &amp; Implementation,45,154,Arizona QuickBooks setup done right from day one.,yes
/find-an-accountant/arizona/small-business-accountant/,find-an-accountant,location-child,t-money,BOFU,Service,yes,7,badge,yes,Arizona Small Business Accountant · TechBrot,44,156,"Your Arizona small business accountant, starting with the books.",yes
/find-an-accountant/california/,find-an-accountant,state-pillar,t-state-pillar,BOFU,Service,yes,12,badge,yes,California QuickBooks ProAdvisors &amp; Bookkeeping · TechBrot,62,158,QuickBooks ProAdvisors &amp; Bookkeeping for California Businesses.,yes
/find-an-accountant/california/ab5-worker-classification/,find-an-accountant,location-child,t-location-child,BOFU,Service,yes,8,none,yes,California AB5 Worker Classification · TechBrot,47,147,"AB5 in your books &mdash; W-2 and 1099, separated and defensible.",yes
/find-an-accountant/california/bookkeeping-services/,find-an-accountant,location-child,t-location-child,BOFU,Service,yes,8,none,yes,California Bookkeeping Services · TechBrot,42,153,"California bookkeeping services &mdash; reconciled, sales-tax-ready, CPA-ready.",yes
/find-an-accountant/california/business-tax-problems/,find-an-accountant,location-child,t-location-child,BOFU,Service,yes,8,none,yes,California Business Tax Problems (Books First) · TechBrot,57,158,Most California &lsquo;tax problems&rsquo; start in the books.,yes
/find-an-accountant/california/cities/,find-an-accountant,location-child,t-location,BOFU,CollectionPage,yes,6,none,yes,California Cities We Serve · Bookkeeping · TechBrot,51,151,A California bookkeeper for your city — and your city's taxes.,yes
/find-an-accountant/california/cities/anaheim/,find-an-accountant,location-child,t-location-child,BOFU,Service,yes,8,none,yes,Anaheim Bookkeeper &amp; QuickBooks Accountant · TechBrot,57,156,Anaheim bookkeeper &amp; QuickBooks accountant.,yes
/find-an-accountant/california/cities/bakersfield/,find-an-accountant,location-child,t-location-child,BOFU,Service,yes,8,none,yes,Bakersfield Bookkeeper &amp; QuickBooks Accountant · TechBrot,61,152,Bakersfield bookkeeper &amp; QuickBooks accountant.,yes
/find-an-accountant/california/cities/fresno/,find-an-accountant,location-child,t-location-child,BOFU,Service,yes,8,none,yes,Fresno Bookkeeper &amp; QuickBooks Accountant · TechBrot,56,156,Fresno bookkeeper &amp; QuickBooks accountant.,yes
/find-an-accountant/california/cities/long-beach/,find-an-accountant,location-child,t-location-child,BOFU,Service,yes,8,none,yes,Long Beach Bookkeeper &amp; QuickBooks Accountant · TechBrot,60,149,Long Beach bookkeeper &amp; QuickBooks accountant.,yes
/find-an-accountant/california/cities/los-angeles/,find-an-accountant,location-child,t-location-child,BOFU,Service,yes,8,none,yes,Los Angeles Bookkeeper &amp; QuickBooks Accountant · TechBrot,61,159,Los Angeles bookkeeper &amp; QuickBooks accountant.,yes
/find-an-accountant/california/cities/oakland/,find-an-accountant,location-child,t-location-child,BOFU,Service,yes,8,none,yes,Oakland Bookkeeper &amp; QuickBooks Accountant · TechBrot,57,152,Oakland bookkeeper &amp; QuickBooks accountant.,yes
/find-an-accountant/california/cities/riverside/,find-an-accountant,location-child,t-location-child,BOFU,Service,yes,8,none,yes,Riverside Bookkeeper &amp; QuickBooks Accountant · TechBrot,59,154,Riverside bookkeeper &amp; QuickBooks accountant.,yes
/find-an-accountant/california/cities/sacramento/,find-an-accountant,location-child,t-location-child,BOFU,Service,yes,8,none,yes,Sacramento Bookkeeper &amp; QuickBooks Accountant · TechBrot,60,159,Sacramento bookkeeper &amp; QuickBooks accountant.,yes
/find-an-accountant/california/cities/san-diego/,find-an-accountant,location-child,t-location-child,BOFU,Service,yes,8,none,yes,San Diego Bookkeeper &amp; QuickBooks Accountant · TechBrot,59,149,San Diego bookkeeper &amp; QuickBooks accountant.,yes
/find-an-accountant/california/cities/san-francisco/,find-an-accountant,location-child,t-location,BOFU,Service,yes,8,none,yes,San Francisco Bookkeeper &amp; QuickBooks Accountant · TechBrot,63,139,San Francisco bookkeeper &amp; QuickBooks accountant.,yes
/find-an-accountant/california/cities/san-jose/,find-an-accountant,location-child,t-location-child,BOFU,Service,yes,8,none,yes,San Jose Bookkeeper &amp; QuickBooks Accountant · TechBrot,58,156,San Jose bookkeeper &amp; QuickBooks accountant.,yes
/find-an-accountant/california/cleanup-bookkeeping/,find-an-accountant,location-child,t-location-child,BOFU,Service,yes,8,none,yes,California Bookkeeping Cleanup &amp; Catch-Up · TechBrot,56,158,California bookkeeping cleanup &amp; catch-up &mdash; from behind to CPA-ready.,yes
/find-an-accountant/california/industries/,find-an-accountant,location-child,t-location,BOFU,CollectionPage,yes,6,none,yes,California Industry-Specific Accounting · TechBrot,50,154,"California accounting, built for your industry.",yes
/find-an-accountant/california/industries/agency/,find-an-accountant,location-child,t-location-child,BOFU,Service,yes,8,none,yes,California Agency &amp; SaaS Accounting (ASC 606) · TechBrot,60,153,California agency accounting that books revenue the way it&rsquo;s really earned.,yes
/find-an-accountant/california/industries/construction/,find-an-accountant,location-child,t-location-child,BOFU,Service,yes,8,none,yes,California Construction Accounting &amp; Job Costing · TechBrot,63,153,California construction accounting that knows which job made money.,yes
